78,WBA,RPT-UPDATE 4-Walgreens U.S. retail sales rise less than expected,"(Repeats to widen distribution) * Q3 US retail sales up 0.1 pct vs. estimates of 0.7 pct * Co has been investing to revive U.S. retail business * Q3 total sales miss estimates, adjusted EPS beats * Raises lower end of FY adjusted profit forecast * Shares fall as much as 3.5 percent By Sruthi Ramakrishnan July 6 (Reuters) - Walgreens Boots Alliance Inc, the No.1 U.S. drugstore operator by store count, reported a lower-than-expected increase in quarterly sales, hurt by weak demand for over-the-counter drugs and other products. The company’s shares fell as much as 3.5 percent on Wednesday. Walgreens has been investing to revive U.S. retail sales, or front-end sales, mainly by sprucing up its beauty business, which is a big traffic driver. It is rolling out a revamped beauty division to more than 1,800 stores by end of 2016. However, comparable sales in the business were underwhelming in the latest third quarter, rising just 0.1 percent, after two quarters of declines. Analysts were expecting U.S. retail sales, which accounts for roughly a third of total U.S. sales, to increase 0.7 percent, according to Evercore ISI. The rest of Walgreens’ U.S. sales comes from its pharmacy business, where comparable sales rose 6 percent due to a jump in prescriptions filled for Medicare Part D drugs. Total net sales rose 2.4 percent to $29.5 billion, missing analysts average estimate of $29.71 billion, according to Thomson Reuters I/B/E/S. Excluding items, Walgreens’ profit of $1.18 per share beat analysts average estimate of $1.14. Walgreens said its acquisition of Rite Aid Corp was on track to close later this year and that it was looking for buyers for the stores it needed to divest to get regulatory clearance. Rite Aid’s shares rose 2 percent. “While USA Retail is facing some pressure, we believe that the RAD deal will cause sentiment in USA Retail to shift positively once integration efforts begin,” Leerink Partners analyst David Larsen wrote in a note. Walgreens also said it was bracing for a long period of volatility following Britain’s shock vote to leave the European Union. The company’s revenue from UK, about 9 percent of sales last fiscal, could be a cause for concern, especially with the pound falling about 13 percent against the dollar since the vote on June 23. “The situation is very volatile at this time. For sure, the period of uncertainty will be quite long,” Chief Executive Stefano Pessina said. The depreciation of the pound would hit Walgreens’ sales in the near term and more than offset any sales gains in local currency terms, said Neil Saunders, chief executive of research firm Conlumino. Still, the company bumped up the lower end of its fiscal 2016 profit forecast - to $4.45-$4.55 per share from $4.35-$4.55.   (Reporting by Sruthi Ramakrishnan in Bengaluru; Editing by Savio D’Souza)",7062016,http://www.reuters.com/article/walgreens-boots-results/rpt-update-4-walgreens-u-s-retail-sales-rise-less-than-expected-idUSL4N19S3V9
79,WBA,Walgreens U.S. retail sales rise less than expected,"(Reuters) - Walgreens Boots Alliance Inc (WBA.O), the No.1 U.S. drugstore operator by store count, reported a lower-than-expected increase in quarterly sales, hurt by weak demand for over-the-counter drugs and other products. The company’s shares fell as much as 3.5 percent on Wednesday. Walgreens has been investing to revive U.S. retail sales, or front-end sales, mainly by sprucing up its beauty business, which is a big traffic driver. It is rolling out a revamped beauty division to more than 1,800 stores by end of 2016. However, comparable sales in the business were underwhelming in the latest third quarter, rising just 0.1 percent, after two quarters of declines. Analysts were expecting U.S. retail sales, which accounts for roughly a third of total U.S. sales, to increase 0.7 percent, according to Evercore ISI. The rest of Walgreens’ U.S. sales comes from its pharmacy business, where comparable sales rose 6 percent due to a jump in prescriptions filled for Medicare Part D drugs. Total net sales rose 2.4 percent to $29.5 billion, missing analysts average estimate of $29.71 billion, according to Thomson Reuters I/B/E/S. Excluding items, Walgreens’ profit of $1.18 per share beat analysts average estimate of $1.14. Walgreens said its acquisition of Rite Aid Corp (RAD.N) was on track to close later this year and that it was looking for buyers for the stores it needed to divest to get regulatory clearance. Rite Aid’s shares rose 2 percent. “While USA Retail is facing some pressure, we believe that the RAD deal will cause sentiment in USA Retail to shift positively once integration efforts begin,” Leerink Partners analyst David Larsen wrote in a note. Walgreens also said it was bracing for a long period of volatility following Britain’s shock vote to leave the European Union. The company’s revenue from UK, about 9 percent of sales last fiscal, could be a cause for concern, especially with the pound falling about 13 percent against the dollar since the vote on June 23. “The situation is very volatile at this time. For sure, the period of uncertainty will be quite long,” Chief Executive Stefano Pessina said. The depreciation of the pound would hit Walgreens’ sales in the near term and more than offset any sales gains in local currency terms, said Neil Saunders, chief executive of research firm Conlumino. Still, the company bumped up the lower end of its fiscal 2016 profit forecast – to $4.45-$4.55 per share from $4.35-$4.55. ",7062016,http://www.reuters.com/article/us-walgreens-boots-results/walgreens-u-s-retail-sales-rise-less-than-expected-idUSKCN0ZM10G
80,WBA,UPDATE 4-Walgreens U.S. retail sales rise less than expected,"(Reuters) - Walgreens Boots Alliance Inc (WBA.O), the No.1 U.S. drugstore operator by store count, reported a lower-than-expected increase in quarterly sales, hurt by weak demand for over-the-counter drugs and other products. The company’s shares fell as much as 3.5 percent on Wednesday. Walgreens has been investing to revive U.S. retail sales, or front-end sales, mainly by sprucing up its beauty business, which is a big traffic driver. It is rolling out a revamped beauty division to more than 1,800 stores by end of 2016. However, comparable sales in the business were underwhelming in the latest third quarter, rising just 0.1 percent, after two quarters of declines. Analysts were expecting U.S. retail sales, which accounts for roughly a third of total U.S. sales, to increase 0.7 percent, according to Evercore ISI. The rest of Walgreens’ U.S. sales comes from its pharmacy business, where comparable sales rose 6 percent due to a jump in prescriptions filled for Medicare Part D drugs. Total net sales rose 2.4 percent to $29.5 billion, missing analysts average estimate of $29.71 billion, according to Thomson Reuters I/B/E/S. Excluding items, Walgreens’ profit of $1.18 per share beat analysts average estimate of $1.14. Walgreens said its acquisition of Rite Aid Corp (RAD.N) was on track to close later this year and that it was looking for buyers for the stores it needed to divest to get regulatory clearance. Rite Aid’s shares rose 2 percent. “While USA Retail is facing some pressure, we believe that the RAD deal will cause sentiment in USA Retail to shift positively once integration efforts begin,” Leerink Partners analyst David Larsen wrote in a note. Walgreens also said it was bracing for a long period of volatility following Britain’s shock vote to leave the European Union. The company’s revenue from UK, about 9 percent of sales last fiscal, could be a cause for concern, especially with the pound falling about 13 percent against the dollar since the vote on June 23. “The situation is very volatile at this time. For sure, the period of uncertainty will be quite long,” Chief Executive Stefano Pessina said. The depreciation of the pound would hit Walgreens’ sales in the near term and more than offset any sales gains in local currency terms, said Neil Saunders, chief executive of research firm Conlumino. Still, the company bumped up the lower end of its fiscal 2016 profit forecast – to $4.45-$4.55 per share from $4.35-$4.55. ",7062016,http://www.reuters.com/article/walgreens-boots-results/update-4-walgreens-u-s-retail-sales-rise-less-than-expected-idUSL4N19S30N
81,WBA,BRIEF-Walgreens Boots CEO says difficult to gauge impact from Brexit at this time,"July 6 (Reuters) - Walgreens Boots Alliance Inc * CEO -have already improved base salary for lowest wage workers * CEO - Britain’s vote to leave EU has created some uncertainty and volatility in our market * CEO on Brexit - confident we will emerge well-positioned as we enter more optimistic times * CFO- UK government has been consulting with industry on pharmacy funding, waiting to hear their conclusions * Majority of the $1.5 billion savings is coming from the USA pharmacy business * CEO-We are very confident that Rite Aid deal will go through, “lawyers are telling us that we don’t have any negative signals” * CEO- “we are trying to find the right buyers for the pharmacy sector we will have to divest” * Executive-We will continue to improve minimum wage paying close attention to the market * CEO on possible Brexit impact- “very very difficult to say. The situation is very volatile at this time. For sure, the period of uncertainty will be quite long” * CEO- Consequence of Britain leaving EU will be much longer than 2 years, in a few months probably will be able to say something on possible impact   Further company coverage:    (Bengaluru Newsroom: +1 646 223 8780)",7062016,http://www.reuters.com/article/idUSL8N19S38X
82,WBA,BRIEF-Walgreens Boots Alliance Q3 adjusted EPS $1.18,"July 6 (Reuters) - Walgreens Boots Alliance Inc * Walgreens Boots Alliance reports fiscal 2016 third quarter results * Q3 sales $29.5 billion versus I/B/E/S view $29.71 billion * Q3 adjusted earnings per share $1.18 * Q3 gaap earnings per share $1.01 * Q3 earnings per share view $1.14 — Thomson Reuters I/B/E/S * Now anticipates adjusted net earnings per diluted share attributable to Walgreens Boots Alliance of $4.45 to $4.55 * Says guidance assumes no impact from proposed acquisition of rite aid and related financing * Retail pharmacy USA had Q3 total sales of $21.2 billion, an increase of 3.7 percent over year-ago quarter * Qtrly sales in comparable stores for retail pharmacy usa increased 3.9 percent compared with same quarter a year ago * Raises lower end of guidance for fiscal year 2016 by 10 cents per share * On constant currency basis, qtrly comparable store sales up 0.2 percent versus year-ago quarter for retail pharmacy international  Source text for Eikon:  Further company coverage:",7062016,http://www.reuters.com/article/idUSASC08W5N
83,WBA,Drugstore operator Walgreens quarterly sales rise 2.4 pct,"July 6 (Reuters) - Drugstore operator Walgreens Boots Alliance Inc reported a 2.4 percent rise in quarterly sales, helped by demand for Medicare Part D drugs and non-pharmacy products in the United States. The company’s net sales rose to $29.5 billion in the third quarter ended May 31, from $28.8 billion a year earlier. Net income attributable to the company fell to $1.10 billion, or $1.01 per share, from $1.30 billion, or $1.18 per share.    (Reporting by Sruthi Ramakrishnan in Bengaluru; Editing by Savio D’Souza)",7062016,http://www.reuters.com/article/walgreens-boots-results/drugstore-operator-walgreens-quarterly-sales-rise-2-4-pct-idUSL4N19R3YX
84,WBA,BRIEF-Walgreens Boots Alliance announces secondary stock offering,July 26 (Reuters) - Walgreens Boots Alliance Inc : * Says secondary offering of 15.0 million common shares * Walgreens Boots Alliance announces secondary common stock offering  Source text for Eikon:  Further company coverage:    (Bengaluru Newsroom: +1-646-223-8780),7262016,http://www.reuters.com/article/idUSASC08YHR
85,WBA,CORRECTED-BRIEF-Walgreens to shut U.S. retail pharmacy business on two of its websites,"(Corrects headline to say “Walgreens to shut U.S. retail pharmacy business on two of its websites” not “Walgreens says retail pharmacy U.S. division to cease operations”) July 28 (Reuters) - Walgreens Boots Alliance Inc * Announced that its retail pharmacy U.S. division plans to cease operations at its drugstore.com and beauty.com properties. * Expects that substantially all charges will be recognized during Q4 and Q1 * Actions part of  previously-announced cost transformation program, and are expected to be completed by end of September 2016. * Currently estimates that it will recognize pre-tax charges to its GAAP financial results of about $115 million relating to actions  Source text for Eikon:  Further company coverage:",7282016,http://www.reuters.com/article/idUSFWN1AE13L
86,WBA,BRIEF-Walgreens exercises second tranche of warrants to purchase AmerisourceBergen shares,Aug 25 (Reuters) - Walgreens Boots Alliance Inc * Says  exercises second tranche of warrants to purchase AmerisourceBergen shares * Says  warrants were originally scheduled to be exercisable in March 2017  Source text for Eikon:  Further company coverage:,8252016,http://www.reuters.com/article/idUSFWN1B60HD
87,WBA,Walgreens to partner with pharmacy benefit manager Prime Therapeutics,"(Reuters) - Walgreens Boots Alliance Inc (WBA.O) said it would partner with pharmacy benefit manager Prime Therapeutics to reduce drug procurement costs. The companies will combine their central specialty pharmacy and mail order service businesses and introduce a new retail pharmacy network that will give Prime Therapeutics’ customers access to Walgreens’ pharmacy network. Specialty pharmacies provide drugs to people with expensive chronic conditions such as rheumatoid arthritis. Walgreens has four central specialty pharmacies that mainly provide mail order services. Pharmacy benefit managers (PBMs) administer drug benefits for employers and health plans, helping them get better prices from drugmakers. The combined entity will be owned by Walgreens and Prime Therapeutics but will have a separate board and executive team, which will be announced later this year. Walgreens, the largest U.S. drugstore operator by store count, already has partnerships with PBMs such as Express Scripts Holding Co (ESRX.O) and UnitedHealth Group Inc’s (UNH.N) OptumRx. Walgreens is also in talks to acquire Rite Aid Corp (RAD.N), which will give it ownership of Rite Aid’s PBM, EnvisionRx. Prime Therapeutics, the fourth-largest U.S. PBM, is owned by 14 leading Blue Cross and Blue Shield health plans. ",8292016,http://www.reuters.com/article/us-walgreens-boots-partnership-prime-the/walgreens-to-partner-with-pharmacy-benefit-manager-prime-therapeutics-idUSKCN1141F0
88,WBA,UPDATE 1-Walgreens to partner with pharmacy benefit manager Prime Therapeutics,"(Reuters) - Walgreens Boots Alliance Inc (WBA.O) said it would partner with pharmacy benefit manager Prime Therapeutics to reduce drug procurement costs. The companies will combine their central specialty pharmacy and mail order service businesses and introduce a new retail pharmacy network that will give Prime Therapeutics’ customers access to Walgreens’ pharmacy network. Specialty pharmacies provide drugs to people with expensive chronic conditions such as rheumatoid arthritis. Walgreens has four central specialty pharmacies that mainly provide mail order services. Pharmacy benefit managers (PBMs) administer drug benefits for employers and health plans, helping them get better prices from drugmakers. The combined entity will be owned by Walgreens and Prime Therapeutics but will have a separate board and executive team, which will be announced later this year. Walgreens, the largest U.S. drugstore operator by store count, already has partnerships with PBMs such as Express Scripts Holding Co (ESRX.O) and UnitedHealth Group Inc’s (UNH.N) OptumRx. Walgreens is also in talks to acquire Rite Aid Corp (RAD.N), which will give it ownership of Rite Aid’s PBM, EnvisionRx. Prime Therapeutics, the fourth-largest U.S. PBM, is owned by 14 leading Blue Cross and Blue Shield health plans. ",8292016,http://www.reuters.com/article/walgreens-boots-partnership-prime-therap/update-1-walgreens-to-partner-with-pharmacy-benefit-manager-prime-therapeutics-idUSL3N1BA3UM
89,WBA,BRIEF-Walgreens and Prime Therapeutics Agree to Form Strategic Alliance,"Aug 29 (Reuters) - Walgreens Boots Alliance Inc * Walgreens and Prime Therapeutics agree to form strategic alliance; includes retail pharmacy network agreement and combines companies’ central specialty pharmacy and mail service businesses * Prime will continue to support client-specific network choices for health plans * Walgreens will be core participant in Prime’s national preferred pharmacy network, beginning Jan. 1, 2017 * Combined company will be consolidated by parent company of Walgreens, in its financial statements  Source text for Eikon:  Further company coverage:",8292016,http://www.reuters.com/article/idUSASC094O6
90,WBA,Walgreens to partner with pharmacy benefit manager Prime Therapeutics,"Aug 29 (Reuters) - Walgreens Boots Alliance Inc said it would combine its central specialty pharmacy and mail service businesses with pharmacy benefit manager Prime Therapeutics, as part of a long-term agreement. Walgreens, the largest U.S. drugstore operator by store count, also said the partnership would introduce a new retail pharmacy network that would give Prime Therapeutics’ customers access to Walgreens preferred pharmacy network.    (Reporting by Sruthi Ramakrishnan in Bengaluru; Editing by Savio D’Souza)",8292016,http://www.reuters.com/article/walgreens-boots-partnership-prime-therap/walgreens-to-partner-with-pharmacy-benefit-manager-prime-therapeutics-idUSL3N1BA3T5
91,WBA,BRIEF-Walgreens Boots Alliance entered into a term loan credit agreement - SEC Filing,"Aug 31 (Reuters) - Walgreens Boots Alliance Inc: * Entered into a term loan credit agreement - SEC Filing * Commitments under certain bridge term loan credit deal, dated as of December 18, 2015, automatically reduced by $1.0 billion * Aggregate commitments of Sumitomo Mitsui Banking Corporation under credit agreement are equal to $1.0 billion  Source text for Eikon: (bit.ly/2cqxQ18) Further company coverage:",8312016,http://www.reuters.com/article/idUSFWN1BC07P
