184,WBA,Drug chains tumble on reports Amazon eyeing their pie,"(Reuters) - Shares of drug retailers Walgreens Boots Alliance Inc (WBA.O), CVS Health Corp (CVS.N) and Rite Aid Corp (RAD.N) tumbled on Friday after reports that Amazon.com Inc (AMZN.O) was looking to make a move into selling drugs online. Amazon is reported to be in discussions with mid-market pharmacy benefit managers and has been hiring talent to assess the drug retailing market for its entry, brokerage firm Leerink analyst Ana Gupte wrote in a note to clients. “We are convinced that AMZN will almost certainly enter the drug distribution value chain within 2 years, evolving into a more disruptive offering over time,” Gupte said. Amazon’s entry into pharmaceuticals has been long rumored in the media. On Friday, CNBC reported that the e-commerce giant would decide before Thanksgiving whether to move into selling prescription drugs online, citing a company email and a source familiar with the matter. (cnb.cx/2hTIxvL) Amazon does not comment on rumors or speculation, a company spokeswoman said. Shares of drug retailers Walgreens closed down 5.8 percent, Rite Aid 4.9 percent and CVS Health 4.9 percent. ",10062017,http://www.reuters.com/article/us-amazon-com-retail/drug-chains-tumble-on-reports-amazon-eyeing-their-pie-idUSKBN1CB2ML
185,WBA,Walgreens beats profit estimates as new contracts provide boost,"(Reuters) - U.S. drugstore chain Walgreens Boots Alliance Inc’s (WBA.O) quarterly profit and revenue beat Wall Street estimates, as the company filled millions of more drug prescriptions thanks to newly won contracts from pharmacy benefit managers. Walgreens, which in June scrapped plans to buy fellow pharmacy company Rite Aid Corp (RAD.N) after a two-year long wait for regulatory approval, has been under pressure from investors to grow drugstore sales faster. Big contracts from pharmacy benefit managers have helped allay some of those concerns and helped Walgreens boost revenue in its latest quarter. The company last year snatched a contract from larger rival CVS Health Corp (CVS.N) to fill prescriptions for Tricare, a Department of Defense healthcare program, and for customers of Prime Therapeutics, a Minnesota-based pharmacy benefit manager. Tricare brought about 9.7 million new members to Walgreens, while Prime Therapeutics added 22 million. Walgreens also formed a venture with Prime, called AllianceRX Walgreens Prime, to handle mail orders and specialty prescriptions for their combined customers. “The formation of AllianceRX Walgreens Prime is primarily responsible for driving up prescription volumes (for Walgreens) including mail and specialty,” Moody’s Vice President Mickey Chadha said via email. Sales at Walgreens’ U.S. pharmacies rose 12.6 percent in the fourth quarter ended Aug. 31, after the company filled 250.2 million prescriptions, up 9 percent from a year ago. Walgreens also said it would review its U.S. stores network, following its acquisition of nearly 2,000 Rite Aid Corp (RAD.N) drugstores. The company expects the review to bring savings of about $300 million each year through 2020. Still, Walgreens also expects to spend $750 million on acquisition costs and another $500 million on store conversions and refurbishing. The impact of Hurricane Maria in Puerto Rico, where Walgreens is the largest drugstore chain, would reduce current-quarter profit by $90 million, the company said on a call with analysts. Deerfield, Illinois-based Walgreens also said it expects 2018 adjusted earnings of $5.40 to $5.70 per share. The forecast was largely above analysts’ average estimate of $5.47, according to Thomson Reuters I/B/E/S. Revenue rose 5.3 percent to $30.15 billion in the fourth quarter, topping analysts’ expectations of $29.93 billion. Net income attributable to Walgreens fell 22 percent to $802 million, hurt mainly by the $325 million termination fee it paid Rite Aid after their failed merger. Excluding one-time items, the company earned $1.31 per share, beating analysts’ expectations of $1.21. Walgreens’ shares were slightly lower at $67.20 in morning trading. ",10252017,http://www.reuters.com/article/us-walgreens-boots-results/walgreens-beats-profit-estimates-as-new-contracts-provide-boost-idUSKBN1CU1GL
186,WBA,UPDATE 2-Walgreens beats profit estimates as new contracts provide boost,"(Reuters) - U.S. drugstore chain Walgreens Boots Alliance Inc’s (WBA.O) quarterly profit and revenue beat Wall Street estimates, as the company filled millions of more drug prescriptions thanks to newly won contracts from pharmacy benefit managers. Walgreens, which in June scrapped plans to buy fellow pharmacy company Rite Aid Corp (RAD.N) after a two-year long wait for regulatory approval, has been under pressure from investors to grow drugstore sales faster. Big contracts from pharmacy benefit managers have helped allay some of those concerns and helped Walgreens boost revenue in its latest quarter. The company last year snatched a contract from larger rival CVS Health Corp (CVS.N) to fill prescriptions for Tricare, a Department of Defense healthcare program, and for customers of Prime Therapeutics, a Minnesota-based pharmacy benefit manager. Tricare brought about 9.7 million new members to Walgreens, while Prime Therapeutics added 22 million. Walgreens also formed a venture with Prime, called AllianceRX Walgreens Prime, to handle mail orders and specialty prescriptions for their combined customers. “The formation of AllianceRX Walgreens Prime is primarily responsible for driving up prescription volumes (for Walgreens) including mail and specialty,” Moody’s Vice President Mickey Chadha said via email. Sales at Walgreens’ U.S. pharmacies rose 12.6 percent in the fourth quarter ended Aug. 31, after the company filled 250.2 million prescriptions, up 9 percent from a year ago. Walgreens also said it would review its U.S. stores network, following its acquisition of nearly 2,000 Rite Aid Corp (RAD.N) drugstores. The company expects the review to bring savings of about $300 million each year through 2020. Still, Walgreens also expects to spend $750 million on acquisition costs and another $500 million on store conversions and refurbishing. The impact of Hurricane Maria in Puerto Rico, where Walgreens is the largest drugstore chain, would reduce current-quarter profit by $90 million, the company said on a call with analysts. Deerfield, Illinois-based Walgreens also said it expects 2018 adjusted earnings of $5.40 to $5.70 per share. The forecast was largely above analysts’ average estimate of $5.47, according to Thomson Reuters I/B/E/S. Revenue rose 5.3 percent to $30.15 billion in the fourth quarter, topping analysts’ expectations of $29.93 billion. Net income attributable to Walgreens fell 22 percent to $802 million, hurt mainly by the $325 million termination fee it paid Rite Aid after their failed merger. Excluding one-time items, the company earned $1.31 per share, beating analysts’ expectations of $1.21. Walgreens’ shares were slightly lower at $67.20 in morning trading. ",10252017,http://www.reuters.com/article/walgreens-boots-results/update-2-walgreens-beats-profit-estimates-as-new-contracts-provide-boost-idUSL4N1N04CG
187,WBA,BRIEF-Walgreens Boots reports Q4 adjusted earnings per share $1.31,"Oct 25 (Reuters) - Walgreens Boots Alliance Inc * Walgreens Boots Alliance reports fourth quarter and fiscal 2017 results * Q4 adjusted earnings per share $1.31 * Q4 GAAP earnings per share $0.76 * Q4 sales $30.1 billion versus I/B/E/S view $29.93 billion * Q4 earnings per share view $1.21 — Thomson Reuters I/B/E/S * Walgreens Boots Alliance Inc - ‍Introduces guidance of $5.40 to $5.70 for fiscal year 2018 adjusted diluted net earnings per share​ * Walgreens Boots Alliance Inc - Qtrly ‍Retail Pharmacy International had Q4 sales of $2.9 billion, a decrease of 3.2 percent from year-ago quarter​ * Walgreens Boots Alliance Inc - ‍Company completes $5.0 billion share repurchase and adds $1.0 billion to program​ * Walgreens Boots Alliance Inc - Qtrly Retail Pharmacy USA ‍sales of $22.3 billion, an increase of 7.5 percent over year-ago quarter​ * Walgreens Boots Alliance Inc - Qtrly Retail Pharmacy USA ‍sales in comparable stores increased 3.1 percent compared with same quarter a year ago​ * Walgreens Boots - Qtrly ‍on constant currency basis, comparable store sales decreased 0.2% compared with year-ago quarter for retail pharmacy international ​ * Walgreens Boots-‍Expects to complete integration of acquired stores relating to Rite Aid deal within next 3 yrs, at estimated cost of about $750 million * Walgreens Boots - ‍In addition, co plans to spend about $500 million of capital on store conversions and related activities regarding  rite aid deal​ * FY2018 earnings per share view $5.47 — Thomson Reuters I/B/E/S * Walgreens Boots Alliance - “‍store optimization program” expected to take place over 18 month period beginning in spring 2018 Source text for Eikon: Further company coverage:",10252017,http://www.reuters.com/article/brief-walgreens-boots-reports-q4-adjuste/brief-walgreens-boots-reports-q4-adjusted-earnings-per-share-1-31-idUSASB0BOJR
188,WBA,Walgreens profit falls 22 pct in 4th quarter,"Oct 25 (Reuters) - U.S. drugstore company Walgreens Boots Alliance Inc’s profit fell 22 percent in the fourth quarter, hurt mainly by a more than $300 million fee it paid Rite Aid Corp after their failed attempt to merge. Net income attributable to Walgreens fell to $802 million or 76 cents per share in the quarter ended Aug. 31, from $1.03 billion, or 95 cents per share, a year earlier. Revenue rose 5.3 percent to $30.15 billion. Walgreens, in June, abandoned its deal to buy Rite Aid after failing to get approval from regulators. Walgreens instead struck a deal to buy nearly half of its smaller rival’s U.S. stores. (Reporting by Gayathree Ganesan in Bengaluru; Editing by Sai Sachin Ravikumar)",10252017,http://www.reuters.com/article/walgreens-boots-results/walgreens-profit-falls-22-pct-in-4th-quarter-idUSL4N1N048G
189,WBA,UPDATE 3-Wal-Mart tie-up helps McKesson top profit estimates,"(Reuters) - McKesson Corp (MCK.N), the biggest U.S. drug distributor, posted a better-than-expected quarterly profit after a tie-up with Wal-Mart Stores Inc (WMT.N) helped it buy generic drugs at lower prices, sending its shares up nearly 6 percent on Thursday. The results come as the industry is coping with a slump in generic drug pricing and a slowdown in the pace of price hikes for branded drugs, with rumors of Amazon.com Inc’s (AMZN.O) entry into the supply chain adding to anxieties. McKesson does not take the entry of any competitor in the drug supply chain lightly, Chief Executive John Hammergren said, drawing similarities between the company and Amazon, especially in terms of logistics. “To some extent, we were Amazon before it was cool to be Amazon,” Hammergren said on a conference call. McKesson and Wal-Mart came together in 2016 to exert their combined negotiating power when buying generic drugs, a tactic also followed by Walgreens Boots Alliance Inc (WBA.O) and other large U.S. retail pharmacies. “We’re purchasing pharmaceuticals at lower prices than we’d expected when we first put the plan together,” McKesson Chief Financial Officer James Beer said. Stubbornly low prices for generic drugs have weighed on the market for copycat drugs and U.S. health regulators’ move to speed up approval of more such drugs is only going to increase the pressure. The alliances between major U.S. retail pharmacies and U.S. drug distributors have allowed wholesalers such as McKesson to avail large discounts on buying generic drugs. ClarusONE, the entity formed by McKesson and Wal-Mart’s tie-up, “is a positive operation for McKesson for sure,” Morningstar analyst Vishnu Lekraj said. With the pace of price increases for branded drugs unlikely to bounce back in the next few years, analysts expect drug distributors will continue to face pressure on their margins. McKesson said its latest second quarter got a boost as some revenue related to branded drugs was recorded in the period, rather than the current third quarter. The company’s revenue rose 4 percent to $52.06 billion in the second quarter. Profit plunged to $1 million, from $307 million, due to goodwill and other long-lived asset impairment charges as well as restructuring costs. Excluding such items, McKesson earned $3.28 per share, sailing past analysts average estimate of $2.80, according to Thomson Reuters I/B/E/S. McKesson’s shares were up 5.8 percent at $160.12. Rivals AmerisourceBergen (ABC.N) rose 3.8 percent and Cardinal Health (CAH.N) 2.6 percent. ",10262017,http://www.reuters.com/article/mckesson-results/update-3-wal-mart-tie-up-helps-mckesson-top-profit-estimates-idUSL4N1N15O0
190,WBA,"BRIEF-Walgreens Boots Alliance says director John Anthony Lederer reports purchase of 20,000 shares on Oct. 26","Oct 30 (Reuters) - Walgreens Boots Alliance Inc * Walgreens Boots Alliance says director John Anthony Lederer reports purchase of 20,000 shares at average price of $67/share on October 26 - SEC filing Source text: (bit.ly/2zRm2LV) Further company coverage:",10302017,http://www.reuters.com/article/brief-walgreens-boots-alliance-says-dire/brief-walgreens-boots-alliance-says-director-john-anthony-lederer-reports-purchase-of-20000-shares-on-oct-26-idUSFWN1N50TM
191,WBA,FTC judge rules against 1-800 Contacts on antitrust charges,"WASHINGTON (Reuters) - A Federal Trade Commission judge has ruled against the online seller 1-800 Contacts, which the agency accused of hammering out deals with rivals that made it harder for consumers to comparison shop, the agency said on Monday. The FTC accused the company of reaching agreements with 14 other online contact lens retailers which required the companies to refrain from advertising to consumers who had searched online for 1-800 Contacts. 1-800 Contacts, in exchange, agreed to not advertise to people who searched for the rivals’ names. The agreements hampered price-conscious consumers from finding rival contact lens sellers and checking their costs, the ruling said. “The evidence in this case demonstrates that the advertising restraints imposed by the challenged agreements cause harm to consumers and competition in the market for the sale of contact lenses online,” wrote Michael Chappell, the FTC administrative law judge who heard the case. The decision was reached on Oct. 20 but withheld until Monday in order to make redactions. Chappell ordered 1-800 Contacts to end the practice of reaching agreements that limit the advertisements of rivals. 1-800 Contacts General Counsel Cindy Williams said she was disappointed in the initial ruling and the company would appeal to the commission. “Nothing in the initial ruling, however, changes our view that the settlement agreements are lawful and procompetitive and that the company will ultimately prevail once the administrative process runs its course,” she said. The deals were reached with Vision Direct, which is owned by Walgreens Boots Alliance Inc; Luxottica Group SpA, which owns LensCrafters and Pearle Vision; and National Vision, among others, according to Chappell’s initial decision. AEA Investors LP is a major owner of 1-800 Contacts.  The online retailer is the world’s largest contact lens store, according to its website. It also has about 50 percent of the market for online sales of contact lenses, according to the FTC complaint filed in the case. ",10302017,http://www.reuters.com/article/ftc-1-800-contacts/ftc-judge-rules-against-1-800-contacts-on-antitrust-charges-idUSL2N1N12T6
192,WBA,BRIEF-Walgreens Boots Alliance completes supply agreement with Fareva,,10312017,http://www.reuters.com/article/brief-walgreens-boots-alliance-completes/brief-walgreens-boots-alliance-completes-supply-agreement-with-fareva-idUSASB0BPXN
193,WBA,BRIEF-PharMerica Q3 2017 adjusted earnings per share $0.46,"Nov 9 (Reuters) - PharMerica Corp: * PharMerica reports third quarter 2017 results * Q3 adjusted earnings per share $0.46 * Q3 earnings per share $0.10 * Q3 earnings per share view $0.50 — Thomson Reuters I/B/E/S * Q3 revenue $595.1 million versus i/b/e/s view $602.4 million * PharMerica - ‍in light of agreement with KKR & Walgreens Boots Alliance, co does not intend to hold earnings conference calls during pendency of transaction​ Source text for Eikon: Further company coverage:",11092017,http://www.reuters.com/article/brief-pharmerica-q3-2017-adjusted-earnin/brief-pharmerica-q3-2017-adjusted-earnings-per-share-0-46-idUSASB0BSZF
194,WBA,BRIEF-Walgreens receives notice of unsolicited mini-tender offer by TRC Capital to purchase up to 2 mln shares,Nov 20 (Reuters) - Walgreens Boots Alliance Inc * Walgreens Boots Alliance - received notice of unsolicited mini-tender offer by TRC Capital Corporation to purchase up to 2 million shares of co’s stock * Walgreens Boots Alliance Inc - the offer to purchase up to 2 million shares of co’s ‍stock is at a price of $67.88 per share in cash​ * Walgreens Boots Alliance Inc - ‍recommends that stockholders do not tender their shares in response to offer​ Source text for Eikon: Further company coverage:,11202017,http://www.reuters.com/article/brief-walgreens-receives-notice-of-unsol/brief-walgreens-receives-notice-of-unsolicited-mini-tender-offer-by-trc-capital-to-purchase-up-to-2-mln-shares-idUSFWN1NQ0Y4
195,WBA,BRIEF-‍Rite Aid Announces First Closings Of Asset Sale To Walgreens Boots Alliance​,Nov 27 (Reuters) - Rite Aid Corp: * ‍RITE AID ANNOUNCES FIRST CLOSINGS OF ASSET SALE TO WALGREENS BOOTS ALLIANCE​ Source text for Eikon: Further company coverage:,11272017,http://www.reuters.com/article/brief-rite-aid-announces-first-closings/brief-rite-aid-announces-first-closings-of-asset-sale-to-walgreens-boots-alliance-idUSFWN1NX0SQ
196,WBA,BRIEF-Walgreens Boots Alliance - CEO Stefano Pessina's 2017 Total Compensation Was $14.7 Million Versus $10.1 Million In 2016,Nov 29 (Reuters) - Walgreens Boots Alliance Inc: * WALGREENS BOOTS ALLIANCE INC - CEO STEFANO PESSINA’S 2017 TOTAL COMPENSATION WAS $14.7 MILLION VERSUS $10.1 MILLION IN 2016 * WALGREENS BOOTS ALLIANCE INC - GLOBAL CHIEF FINANCIAL OFFICER GEORGE FAIRWEATHER'S 2017 TOTAL COMPENSATION WAS $7.4 MILLION VERSUS $6.7 MILLION IN 2016 Source text: (bit.ly/2AiJyTo) Further company coverage:,11292017,http://www.reuters.com/article/brief-walgreens-boots-alliance-ceo-stefa/brief-walgreens-boots-alliance-ceo-stefano-pessinas-2017-total-compensation-was-14-7-million-versus-10-1-million-in-2016-idUSFWN1NZ0AB
197,WBA,BRIEF-China National Accord Medicines's unit brings in strategic investor,Nov 29 (Reuters) - China National Accord Medicines Corp Ltd : * SAYS UNIT HAS BROUGHT IN WALGREENS BOOTS ALLIANCE INC’S HONG KONG UNIT AS STRATEGIC INVESTOR * SAYS WALGREENS BOOTS ALLIANCE'S HONG KONG UNIT INVESTS 2.8 BILLION YUAN  ($424.36 million) FOR 40 PERCENT STAKE IN ITS UNIT Source text in Chinese: bit.ly/2j1C1AG Further company coverage: ($1 = 6.5981 Chinese yuan renminbi) (Reporting by Hong Kong newsroom),11292017,http://www.reuters.com/article/brief-china-national-accord-mediciness-u/brief-china-national-accord-mediciness-unit-brings-in-strategic-investor-idUSL3N1NZ3VL
