330,SLB,Schlumberger lets go of workers in Venezuela as it scales back,"CARACAS/PUNTO FIJO, Venezuela (Reuters) - Oilfield services company Schlumberger has let go of workers and pulled out of projects as it cuts operations in crisis-stricken Venezuela, sparking worker protests and heightening worry over the OPEC country’s slumping oil output. Schlumberger in April said it would reduce activity in the South American OPEC nation, which accounted for less than 5 percent of the company’s consolidated revenue last year, due to insufficient payments and no improvements on the horizon.  As a result, employees working on projects ranging from the oil-rich Maracaibo Lake to the Orinoco Belt are being laid off, workers and a union leader said, an ominous sign for Venezuela’s slumping crude production and crumbling economy.  “They’re getting rid of almost all the workers because they’re reducing operations and the contracts won’t be renovated because of debt owed by PDVSA,” said a Schlumberger employee in Venezuela’s eastern city of Maturin, asking to remain anonymous because he was not authorized to speak with media.  Houston-based Schlumberger declined to comment. Caracas-based PDVSA did not respond to a request for comment. Ivan Freites, a union leader and fierce PDVSA critic, said some 600 workers are being fired in Zulia state, whose capital is Maracaibo, and 2,000 workers are being let go nationally. While the exact number of laid-off workers was not immediately clear, the dismissals could further stoke social unrest as Venezuelans struggle to eat three meals a day amid worsening food shortages and triple-digit inflation. Some Schlumberger workers protested the layoffs in Maracaibo on Wednesday.  A worker in Venezuela’s oil-rich Orinoco Belt said Schlumberger had scaled back its projects and was now only working on Petropiar, a joint venture between PDVSA and U.S. oil company Chevron, and Petromonagas, a joint venture between PDVSA and Russian oil giant Rosneft.  PDVSA, exclusive operator of Venezuela’s vast oilfields, has run up billions of dollars in unpaid bills to service providers as a result of cash-flow problems amid a deep recession.  U.S. oil services company Halliburton Co in April also said it would begin curtailing activity in Venezuela. It also declined to comment on its scale-back.      PDVSA’s president Eulogio Del Pino told Reuters in June that it was close to reaching a deal with Schlumberger to boost services again, but there have been no details on the potential agreement. Schlumberger’s declining presence comes as Venezuelan oil fields suffer from lack of spare parts, a brain drain, crime, and maintenance issues.     The country’s crude output fell to some 2.364 million barrels per day in June, from 2.675 million in the same month last year, according to data OPEC says was provided by Venezuela. The drop could help erode a supply glut that has weighed on prices. Of course, Schlumberger and Halliburton’s dwindling operations in Venezuela could also provide opportunities for their rivals. One Schlumberger source said a PDVSA unit and Bohai Drilling Service, a unit of China National Petroleum Corp (CNPC), were pocketing some of the contracts. An official at Bohai declined to comment and CNPC, China’s top energy group, did not respond to a request for comment. ",9022016,http://www.reuters.com/article/venezuela-oil-schlumberger/schlumberger-lets-go-of-workers-in-venezuela-as-it-scales-back-idUSL1N1B719E
331,SLB,"BRIEF-BP, Rosneft and Schlumberger sign seismic research agreements","Sept 2 (Reuters) - BP Plc : * Rosneft, BP and Schlumberger sign technology agreements * Rosneft, BP and Schlumberger today announced agreements for collaboration on seismic research and development * Rosneft will join as an equal partner in BP’s ongoing project with Schlumberger’s seismic business, WesternGeco, to develop innovative cableless onshore seismic acquisition technology * Project envisages an initial two year period to complete development of a seismic acquisition system * BP, Rosneft will have preferential access to technology for initial period, after which Schlumberger will have exclusive rights to market system  Further company coverage:  For full coverage please click:    (Bengaluru Newsroom)",9022016,http://www.reuters.com/article/idUSFWN1BD0NP
332,SLB,"Rosneft, BP, Schlumberger to collaborate on seismic research","VLADIVOSTOK, Russia, Sept 2 (Reuters) - Russian biggest oil producer Rosneft signed agreements with British oil major BP and top world oilfield services provider Schlumberger for collaboration on seismic research and development, the companies said on Friday. “Under the term of the agreements, Rosneft will join as an equal partner in BP’s ongoing project with Schlumberger’s seismic business, WesternGeco, to develop innovative cableless onshore seismic acquisition technology,” the joint statement said.   (Reporting by Denis Pinchuk; Writing by Maria Tsvetkova; editing by Katya Golubkova)",9022016,http://www.reuters.com/article/russia-vladivostok-forum-rosneft/rosneft-bp-schlumberger-to-collaborate-on-seismic-research-idUSR4N1B5014
333,SLB,Oil market investment needed soon to balance market: Schlumberger CEO,"DUBAI (Reuters) - Investment in exploration and production will have to start increasing soon to help balance the global oil market, Schlumberger CEO Paal Kibsgaard told a conference in Dubai on Monday. The medium- to long-term oil environment will remain subject to periods of volatility and the industry may see fewer and larger service operators in the future, the oilfield services company boss said. ",9262016,http://www.reuters.com/article/us-schlumberger-oil/oil-market-investment-needed-soon-to-balance-market-schlumberger-ceo-idUSKCN11W0LI
334,SLB,"BRIEF-MRC Global announces measurement, instrumentation distribution agreement with Schlumberger",Oct 3 (Reuters) - MRC Global Inc : * MRC Global announces exclusive measurement and instrumentation distribution agreement with Schlumberger * Schlumberger will continue to provide technical support as part of companies’ collaboration  Source text for Eikon:  Further company coverage:,10032016,http://www.reuters.com/article/idUSASC099ZM
335,SLB,Schlumberger profit beats as North America activity ramps up,"(Reuters) - Schlumberger Ltd, the world’s No.1 oilfield services provider, reported a quarterly profit that topped analysts’ expectations as more oil producers put rigs back to work in North America. The company expects improved activity in onshore North American, Middle Eastern and Russian markets next year, Chief Executive Paal Kibsgaard said on Thursday, although he warned of limited visibility into customers’ investment plans for 2017. Halliburton Co, the No.2 oilfield services provider, said on Wednesday that oil prices would have to stabilize at above $50 per barrel for producers to meaningfully increase oilfield activity. Schlumberger is already seeing gains from the North American rig count, which has risen for 15 of the last 16 weeks. Excluding results from Cameron International Corp, which Schlumberger acquired earlier this year, Schlumberger’s third-quarter land revenue in North America rose 14 percent from the second quarter. Higher drilling and fracturing drove the increase, Schlumberger said, adding that pricing improvements were limited as much of the increase in activity was driven by small companies.  Schlumberger, which was historically tilted toward the big oil companies, has been moving “downmarket” to smaller producers, said Edward Jones analyst Rob Desai. The company is also gaining from a contract rider that ties service pricing to oil prices, Desai said. Global crude oil prices have risen nearly 40 percent this year and Kibsgaard said on Thursday that global crude oil supply and demand were “now more or less balanced.”  Strict cost control has helped Schlumberger offset revenue declines caused by a steep fall in exploration and production spending that eroded demand for its services. The company’s pro forma revenue had slumped more than 50 percent in the previous seven quarters, Kibsgaard said, adding that the company had cut $6 billion of costs over the period. “After calling the bottom of the cycle in the second quarter of this year, our business stabilized in the third quarter.”  Net profit attributable to Schlumberger fell to $176 million, or $13 cents per share, in the third quarter ended Sept. 30 from $989 million, or 78 cents per share, a year earlier. Excluding charges related to the Cameron merger and integration, Schlumberger earned 25 cents per share, above the analysts’ average estimate of 22 cents per share, according to Thomson Reuters I/B/E/S. Revenue fell 17 percent to $7.02 billion, shy of analysts’ estimate of 7.08 billion. Schlumberger’s shares have gained nearly a fifth of their value this year up to Thursday’s close of $82.99. ",10202016,http://www.reuters.com/article/us-schlumberger-results/schlumberger-profit-beats-as-north-america-activity-ramps-up-idUSKCN12K2JT
336,SLB,UPDATE 2-Schlumberger profit beats as North America activity ramps up,"(Reuters) - Schlumberger Ltd, the world’s No.1 oilfield services provider, reported a quarterly profit that topped analysts’ expectations as more oil producers put rigs back to work in North America. The company expects improved activity in onshore North American, Middle Eastern and Russian markets next year, Chief Executive Paal Kibsgaard said on Thursday, although he warned of limited visibility into customers’ investment plans for 2017. Halliburton Co, the No.2 oilfield services provider, said on Wednesday that oil prices would have to stabilize at above $50 per barrel for producers to meaningfully increase oilfield activity. Schlumberger is already seeing gains from the North American rig count, which has risen for 15 of the last 16 weeks. Excluding results from Cameron International Corp, which Schlumberger acquired earlier this year, Schlumberger’s third-quarter land revenue in North America rose 14 percent from the second quarter. Higher drilling and fracturing drove the increase, Schlumberger said, adding that pricing improvements were limited as much of the increase in activity was driven by small companies.  Schlumberger, which was historically tilted toward the big oil companies, has been moving “downmarket” to smaller producers, said Edward Jones analyst Rob Desai. The company is also gaining from a contract rider that ties service pricing to oil prices, Desai said. Global crude oil prices have risen nearly 40 percent this year and Kibsgaard said on Thursday that global crude oil supply and demand were “now more or less balanced.”  Strict cost control has helped Schlumberger offset revenue declines caused by a steep fall in exploration and production spending that eroded demand for its services. The company’s pro forma revenue had slumped more than 50 percent in the previous seven quarters, Kibsgaard said, adding that the company had cut $6 billion of costs over the period. “After calling the bottom of the cycle in the second quarter of this year, our business stabilized in the third quarter.”  Net profit attributable to Schlumberger fell to $176 million, or $13 cents per share, in the third quarter ended Sept. 30 from $989 million, or 78 cents per share, a year earlier. Excluding charges related to the Cameron merger and integration, Schlumberger earned 25 cents per share, above the analysts’ average estimate of 22 cents per share, according to Thomson Reuters I/B/E/S. Revenue fell 17 percent to $7.02 billion, shy of analysts’ estimate of 7.08 billion. Schlumberger’s shares have gained nearly a fifth of their value this year up to Thursday’s close of $82.99. ",10202016,http://www.reuters.com/article/schlumberger-results/update-2-schlumberger-profit-beats-as-north-america-activity-ramps-up-idUSL4N1CQ550
337,SLB,Schlumberger reports 17 pct fall in revenue,"Oct 20(Reuters) - Schlumberger Ltd, the world’s No.1 oilfield services provider, reported a 17 percent fall in quarterly revenue, hurt by weaker drilling activity and pricing pressure. Net profit attributable to Schlumberger fell to $176 million, or $13 cents per share, in the third quarter ended Sept. 30 from $989 million, or 78 cents per share, a year earlier. Revenue fell to $7.02 billion from $8.47 billion.   (Reporting by Swetha Gopinath and Arathy S Nair in Bengaluru; Editing by Don Sebastian)",10202016,http://www.reuters.com/article/schlumberger-results/schlumberger-reports-17-pct-fall-in-revenue-idUSL4N1CI4A4
338,SLB,BRIEF-Accenture says Schlumberger expands Accenture finance and accounting business process outsourcing agreement to 2021,Oct 27 (Reuters) - Accenture Plc * Schlumberger expands Accenture finance and accounting business process outsourcing agreement to 2021 * Says expanded five-year agreement to provide Schlumberger with finance and accounting (F&A;) BPO services through 2021  Source text for Eikon:  Further company coverage:,10272016,http://www.reuters.com/article/idUSFWN1CX10K
339,SLB,BRIEF-NOW Inc announces distributorship agreements,Nov 7 (Reuters) - Now Inc * Says company has just entered into an OEM valve automation packaging agreement with Rotork Controls * Has also entered into distributorship agreement with Schlumberger for exclusive right to distribute Schlumberger’s Reda HPS Pumps * Press Release - Now Inc. announces distributorship agreements  Source text for Eikon:  Further company coverage:,11072016,http://www.reuters.com/article/idUSASC09GJR
340,SLB,Ophir signs deal with Schlumberger JV for Equatorial Guinea project,"(Reuters) - British oil and gas explorer Ophir Energy Plc said it had signed an agreement with OneLNGSM, a joint venture between units of Golar LNG Ltd and Schlumberger, to develop the Fortuna project in Equatorial Guinea. Shares in the company rose as much as 13.8 percent, before trading at 77.75 pence at 0956 GMT on the London Stock Exchange on Thursday. Ophir said earlier this month that it could go forward without new partners for the Fortuna floating liquefied natural gas project as the cost estimates had halved to around $450 million. Schlumberger had walked away from the deal in June.  Jefferies analysts said the return of Schlumberger would be looked at positively by the market. The brokerage has a “hold” rating on the stock. Ophir said it would have a 33.8 percent stake in the joint operating company, while OneLNG would own the rest. The company expects the final investment decision to take place in the first half of 2017, with first gas expected in the first half of 2020. The final decision is subject to approval by Ophir shareholders and clearance from the government of Equatorial Guinea. Capital expenditure for the integrated project is expected to be about $2 billion to reach first gas, of which about $1.2 billion is expected to be debt-financed. “Ophir’s committed future expenditure to first gas will not exceed $150 million and certain other commercial exposures have been limited. We will now be able to advance the project while preserving our balance sheet strength,” Ophir CEO Nick Cooper said. ",11102016,http://www.reuters.com/article/us-ophir-schlumberger/ophir-signs-deal-with-schlumberger-jv-for-equatorial-guinea-project-idUSKBN13511F
341,SLB,Ophir signs deal with Schlumberger JV for Equatorial Guinea project,"(Reuters) - British oil and gas explorer Ophir Energy Plc said it had signed an agreement with OneLNGSM, a joint venture between units of Golar LNG Ltd and Schlumberger, to develop the Fortuna project in Equatorial Guinea. Shares in the company rose as much as 13.8 percent, before trading at 77.75 pence at 0956 GMT on the London Stock Exchange on Thursday. Ophir said earlier this month that it could go forward without new partners for the Fortuna floating liquefied natural gas project as the cost estimates had halved to around $450 million. Schlumberger had walked away from the deal in June.  Jefferies analysts said the return of Schlumberger would be looked at positively by the market. The brokerage has a “hold” rating on the stock. Ophir said it would have a 33.8 percent stake in the joint operating company, while OneLNG would own the rest. The company expects the final investment decision to take place in the first half of 2017, with first gas expected in the first half of 2020. The final decision is subject to approval by Ophir shareholders and clearance from the government of Equatorial Guinea. Capital expenditure for the integrated project is expected to be about $2 billion to reach first gas, of which about $1.2 billion is expected to be debt-financed. “Ophir’s committed future expenditure to first gas will not exceed $150 million and certain other commercial exposures have been limited. We will now be able to advance the project while preserving our balance sheet strength,” Ophir CEO Nick Cooper said. ",11102016,http://www.reuters.com/article/ophir-schlumberger/ophir-signs-deal-with-schlumberger-jv-for-equatorial-guinea-project-idUSL4N1DB3H5
342,SLB,BRIEF-Schlumberger 9-mth result after tax and minorities swings to profit,"Nov 10 (Reuters) - Schlumberger AG : * Consolidated sales of Schlumberger Group in first nine months of amounted to 112.0 million euros * 9-month result after taxes and minority interests of about 69,000 euros after a loss of 1.7 million euros in year ago * Is planning a stable development on a comparable basis for the 2016 economic year  Source text - bit.ly/2fnxsgP Further company coverage:    (Gdynia Newsroom)",11102016,http://www.reuters.com/article/idUSFWN1DB0MU
343,SLB,BRIEF-Ophir says Golar and Schlumberger's unit sign agreement to develop Fortuna project,"Nov 10 (Reuters) - Ophir Energy Plc : * Ophir - wholly owned subsidiary , OneLNG SM, A jv between subsidiaries of Golar and Schlumberger, have signed a binding agreement to develop Fortuna Project * Fid is now expected to take place in 1h 2017 with first gas anticipated in 1h 2020 * Initial offtake expected 2.2-2.5 mtpa for a duration of between 15 and 20 years which will monetise around 2.6 tcf of discovered resource * Expected total capital expenditure for integrated project is approximately $2 billion to reach first gas  Source text for Eikon:  Further company coverage:    (Bengaluru Newsroom: +91 80 6749 1136)",11102016,http://www.reuters.com/article/idUSFWN1DB0HE
344,SLB,Nigeria's NNPC partners with Schlumberger for exploration,"ABUJA (Reuters) - Nigeria’s state oil company said on Friday it will partner with oilfield services company Schlumberger (SLB.N) in exploration and reservoir management. The partnership aims to find commercial hydrocarbon deposits in the Chad basin and other inland areas, a statement from the Nigerian National Petroleum Corporation (NNPC) said. A research area for the companies will be “exploration and risks assessment studies of the Nigerian Frontier Basins, which include the Upper Benue where NNPC is currently carrying out exploration works”, the statement quoted Babatunde Adeniran, chief operating officer of ventures at NNPC, as saying. Schlumberger has established a $1 billion research fund, of which NNPC also hopes to take advantage, the statement said. ",1132017,http://www.reuters.com/article/us-nigeria-oil/nigerias-nnpc-partners-with-schlumberger-for-exploration-idUSKBN14X25T
345,SLB,Nigeria's NNPC partners with Schlumberger for exploration,"ABUJA (Reuters) - Nigeria’s state oil company said on Friday it will partner with oilfield services company Schlumberger (SLB.N) in exploration and reservoir management. The partnership aims to find commercial hydrocarbon deposits in the Chad basin and other inland areas, a statement from the Nigerian National Petroleum Corporation (NNPC) said. A research area for the companies will be “exploration and risks assessment studies of the Nigerian Frontier Basins, which include the Upper Benue where NNPC is currently carrying out exploration works”, the statement quoted Babatunde Adeniran, chief operating officer of ventures at NNPC, as saying. Schlumberger has established a $1 billion research fund, of which NNPC also hopes to take advantage, the statement said. ",1132017,http://www.reuters.com/article/nigeria-oil/nigerias-nnpc-partners-with-schlumberger-for-exploration-idUSL4N1F34PY
346,SLB,"BRIEF-Statoil awards service contracts to Baker Hughes, Schlumberger","Jan 18 (Reuters) - Statoil Asa * Says awarding service contracts for two Cat J rigs * Baker Hughes and Schlumberger will be awarded contracts for integrated drilling and well services on Cat J rigs Askepott and Askeladden * Initially awarded for four years contracts include options for two 2-year extensions * Contracts will help increase activities on Norwegian continental shelf, ensure predictability, and create more jobs * Owned by the Gullfaks and Oseberg licences the Cat J jack-up rigs are tailored to the conditions in the North Sea, where they are scheduled to be installed in the summer and autumn of 2017, respectively * Cat J rigs are specially designed to perform efficient drilling operations on subsea development solutions in addition to conventional surface drilling from fixed platforms * The introductory Askeladden drilling programme focuses on proven reserves and gas blowdown wells on one of the Gullfaks satellite fields * Askepott will primarily drill through the unmanned wellhead platform at Vestflanken 2, which is part of Oseberg  Source text: bit.ly/2izZOtC Further company coverage:    (Reporting By Terje Solsvik)",1182017,http://www.reuters.com/article/idUSFWN1F808P
347,SLB,BRIEF-Schlumberger board amends by-laws to provide for proxy access,"Jan 19 (Reuters) - Schlumberger NV : * Schlumberger- On Jan 19, board amended the company’s amended and restated by-laws to provide for proxy access - SEC filing * Schlumberger- Amended the by-laws to also include advance notice provisions addressing the nomination of persons for election to the board  Source text: (bit.ly/2jdIRkI) Further company coverage:",1192017,http://www.reuters.com/article/idUSFWN1F90ZY
348,SLB,Schlumberger expects international markets recovery in late 2017,"(Reuters) - Schlumberger NV said on Friday that it does not expect a “dramatic” short-term recovery in international markets, compared with North America where shale producers are already ramping up drilling activity. The world’s No.1 oilfield services provider reported a more-than-8-percent drop in fourth-quarter revenue as strong activity in the Middle East and North America was offset by weakness in Latin America, Europe, Russia and Africa. “Our international business is currently like a highly-compressed coiled spring,” Chief Executive Paal Kibsgaard said on an analyst call. “Activity levels in key market segments such as exploration and deepwater are at record lows and although we do not expect a dramatic short-term recovery, the trends can only be positive from this point on.” With crude oil prices on the rise, oil companies have begun to ramp up exploration and production spending, particularly in North American shale fields, after two years of budget cuts. However, Kibsgaard expects a global increase to unfold only later this year – a view that Edward Jones analyst Rob Desai agreed with. “The end of 2017 is when you start to see things really improve in international markets,” Desai said. Schlumberger’s earnings from international markets, including Mexico, Venezuela, Brazil, Sub-Sahara Africa, China and onshore Russia, in the fourth quarter of 2016 was more than 70 percent lesser than its earnings in the fourth quarter of 2014, when oil prices began to slump. The company is far more reliant on markets outside North America than its rivals Halliburton Co and Baker Hughes Inc. Schlumberger gets only a quarter of its revenue from North America, while Halliburton gets more than 40 percent. Schlumberger’s fourth-quarter revenue from North America rose 4 percent to $1.77 billion compared with the third quarter. Desai said he had expected a 6 percent increase, given the roughly 22 percent rise in average U.S. rig count in the period. Schlumberger’s revenue growth in international markets was slower, rising 1 percent to $5.28 billion from the third to the fourth quarter. Net loss attributable to Schlumberger fell to $204 million, or 15 cents per share, in the three months ended Dec. 31, from $1.02 billion, or 81 cents per share, a year earlier. bit.ly/2jGqJn7 Excluding one-time items, Schlumberger earned 27 cents per share, in-line with analysts’ average estimate, according to Thomson Reuters I/B/E/S. Total revenue was $7.11 billion, edging past analysts’ estimate of $7.07 billion. Schlumberger’s shares were down 1.7 percent at $85.73 in morning trading. ",1202017,http://www.reuters.com/article/us-schlumberger-results/schlumberger-expects-international-markets-recovery-in-late-2017-idUSKBN1541IF
