208,SLB,"U.S. oil drilling faces slow recovery, no new highs -Schlumberger","NEW YORK, April 17 (Reuters) - An eventual recovery in U.S. oil drilling activity after the biggest slump in three decades may never reach last year’s frenzied pace, according to the world’s largest oilfield services company. The drilling recovery will likely to be slower to emerge due to a growing reserve of wells that have been drilled but not yet hydraulically fractured and increased activity in re-fracking wells that are running dry, Schlumberger Ltd Chief Executive Paal Kibsgaard said in a conference call Friday. Schlumberger expects the rebound in U.S. onshore drilling “will be pushed out in time as the inventory of uncompleted wells drilled and the refracturing market expand,” Kibsgaard told analysts following the announcement of the company’s earnings. The recovery “will fall well short of reaching previous levels.” The message suggests that the disconnect between rigs drilling for oil and the trajectory of U.S. production may get worse before it gets better. While U.S. output rose in tandem with the number of rigs in the early years of the shale boom, output has continued climbing even as the rig count collapses to less than half its October peak. The decline in oil rigs slowed this week but left their number at the lowest since 2010, Baker Hughes Inc, another oil services firm, said separately on Friday. Now, fracking a backlog of wells and reviving existing ones could mean that oil production begins to recover even as the number of rigs drilling new wells remains depressed. “There were a number of people still out there who were still expecting a v-shaped recovery,” said James Wicklund, managing director of equity research at Credit Suisse. The recovery will instead be shaped like a bathtub, scraping along the bottom, with drilling levels remaining depressed for the coming four to five years, he said. In part, the return to drilling will lag because producers will begin to frack drilled uncompleted wells - wells that have been opened up, but have not yet had the oil extracted from them. “At least 2,700 wells have been identified as candidates for refracture in North America,” said James West, an analyst at EvercoreISI. The Eagle Ford likely contains 1,000 of these wells, known as DUCs, according to West’s estimate, while the Bakken has about 500, and the Marcellus, Niobrara, and Haynesville each contain over 300 candidates. The market value of these opportunities together is about $5 billion, he said.     (Reporting By Jessica Resnick-Ault; Editing by Christian Plumb)",4172015,http://www.reuters.com/article/oil-recovery-schlumberger-nv/u-s-oil-drilling-faces-slow-recovery-no-new-highs-schlumberger-idUSL2N0XE1V320150417
209,SLB,"UPDATE 1-Schlumberger impresses with cost cuts, resilient margins","(Adds background, CEO quotes) By Swetha Gopinath and Sayantani Ghosh April 17 (Reuters) - Schlumberger Ltd, the world’s No.1 oilfield services provider, reported a smaller-than-expected fall in first-quarter margins as it continued to execute tight cost controls to combat a decline in drilling activity. Schlumberger shares rose as much as 3.3 percent to a near-five-month high of $94.89 on Friday, a day after the company reported a profit well ahead of analysts’ expectations despite a 9 percent drop in quarterly revenue. “Market pricing for certain products and services (in North America) has already reached unsustainable levels,” Chief Executive Paal Kibsgaard said on a conference call with analysts on Friday. “However, we are being selective in the pursuit of market share and very disciplined in the avoidance of loss-making contracts.” Resilience in its international business, which accounts for more than two-thirds of Schlumberger’s total revenue, helped drive profit. “I think the overall resilience in our well-balanced international business is underestimated,” Kibsgaard said. Schlumberger’s cost of revenue fell 7 percent in the quarter ended Mar. 31. Operating margins shrunk to 17.6 percent from 19.3 percent a year earlier, but were higher than the estimates of some analysts tracked by Reuters. Evercore ISI analysts, who had predicted margins of 14.5 percent, said the company had “exceeded our expectations in its ability to swiftly reduce its cost structure to correspond to industry realities.” “Schlumberger was likely the most proactive company in the group preparing for the downturn, swiftly adjusting to changing market conditions,” they said. The Houston-based company plans to cut 11,000 jobs, bringing the total job cuts announced this year to 20,000 - about 15 percent of its workforce. A 44 percent slide in crude prices since June has also prompted nearly 13,000 job cuts at rivals Halliburton Co  and Baker Hughes Inc, who are set to merge in a $35 billion deal. Kibsgaard said he expects a recovery in U.S. land drilling activity to be delayed as energy companies on stringent budgets deploy fewer rigs, forcing services firms to continue discounting. “We don’t expect that rig counts are going to come back to the previous levels of around 2,000. It’s going to come back somewhere in between the current levels and where it was.” There were 760 rigs drilling for oil in the United States as of April 10, according to Baker Hughes’ closely watched survey. ",4172015,http://www.reuters.com/article/schlumberger-costs/update-1-schlumberger-impresses-with-cost-cuts-resilient-margins-idUSL4N0XE4FC20150417
210,SLB,UPDATE 1-QUOTEBOX-Schlumberger CEO on the effects of low oil prices,"(Adds CEO comment on OPEC) April 17 (Reuters) - Schlumberger Ltd, the world’s No. 1 oilfield services provider, said it would cut a further 11,000 jobs and had reduced its capital spending plan for the year in anticipation of an extended lull in activity and slump in pricing. The company’s first-quarter profit beat the average analyst estimate after it exercised strict cost controls. Schlumberger executives spoke to analysts on a conference call on Friday, a day after the company reported. Here is a selection of comments from Chief Executive Paal Kibsgaard: “The pace and magnitude of the activity reductions, particularly in North America, has been almost unprecedented and we have to go back to the mid-1980s to find anything similar.” “In the U.S. Gulf of Mexico, deepwater activity was resilient in the first quarter, although we’re seeing a steady change in service mix from exploration towards development work, driven by budget cuts from most of our customers.” “Market pricing for certain products and services (in North America) has already reached unsustainable levels. However, we’re being selective in the pursuit of market share and very disciplined in the avoidance of loss-making contracts.” “In terms of managing the pricing pressure, we remain fully focused on navigating the commercial landscape by carefully balancing the pursuit of market share with the protection of operating margins and by always aiming to trade any pricing concessions for additional work scope or better contract terms.” “Looking at the industry as a whole, the current financial challenges will not disappear, even if oil prices were to recover to the levels seen in recent years. The industry is therefore forced to seek new ways of working together to reduce costs and create more project value.” “We expect the largest E&P; (exploration and production) investments to occur in North America, where 2015 spend is expected to be down by more than 30 percent. We further believe our recovery in U.S. land drilling activity will be pushed out in time as the inventory of uncompleted wells drilled and the refracturing market expand. We also anticipate our recovery in North America land activity will fall well short of reaching previous levels.” “In the international market, we expect 2015 E&P; spend to fall around 16 percent, which will create challenges in terms of activity and pricing levels, but considerably less than the headwinds seen in North America.” “I’d say there are thousands of wells in North America land that are candidates for refracturing and this is both shale liquids and shale gas.” “... The pricing concessions that are currently being given, we unfortunately are going to have to live with for a while, because it’s going to be a pretty significant overcapacity for all sorts of services given the lower activity level ...” “There is a weakness in the non-NAM (North America), non-OPEC supply base. It was basically flat Q1 year-over-year, but given the reductions we’re seeing in spend and the weakness in several of the key basins, we expect that weakness to continue and potentially increase as the year progresses, and I think that’s why we believe that there will be some recovery in Brent. “The question is to what extent OPEC wants or is willing to put more balance on the market to stabilize prices at some level below $100.”   (Reporting by Anet Josline Pinto and Swetha Gopinath in Bengaluru)",4172015,http://www.reuters.com/article/schlumberger-nv-costs-ceo/update-1-quotebox-schlumberger-ceo-on-the-effects-of-low-oil-prices-idUSL4N0XE4EL20150417
211,SLB,Schlumberger shares rise as cost cuts impress,"April 17 (Reuters) - Schlumberger Ltd’s shares rose as much as 3.3 percent on Friday, after tight cost controls helped the world’s No.1 oilfield services provider report higher-than-expected margins in the first quarter. While Schlumberger said on Thursday that lower activity and pricing pressure led to a 9 percent drop in quarterly revenue, profits came in well ahead of analysts’ expectations. “Market pricing for certain products and services (in North America) has already reached unsustainable levels,” Chief Executive Paal Kibsgaard said on a conference call with analysts on Friday. “However, we are being selective in the pursuit of market share and very disciplined in the avoidance of loss-making contracts.” Schlumberger shares were up 2.4 percent at $94.08 on the New York Stock Exchange in early trading, after touching a near-five-month high of $94.89. The company now plans to cut 11,000 jobs, bringing the total job cuts announced this year to 20,000 - about 15 percent of its workforce. A 44 percent slide in crude prices since June has also prompted nearly 13,000 job cuts at rivals Halliburton Co  and Baker Hughes Inc, who are set to merge in a $35 billion deal. Schlumberger’s cost of revenue fell 7 percent in the quarter ended Mar. 31. Operating margins shrunk to 17.6 percent from 19.3 percent a year earlier, but were higher than the estimates of some analysts tracked by Reuters. Evercore ISI analysts, who had predicted margins of 14.5 percent, said the company had “exceeded our expectations in its ability to swiftly reduce its cost structure to correspond to industry realities.” “Schlumberger was likely the most proactive company in the group preparing for the downturn, swiftly adjusting to changing market conditions,” they said.   (Reporting by Sayantani Ghosh and Swetha Gopinath in Bengaluru; Editing by Joyjeet Das)",4172015,http://www.reuters.com/article/schlumberger-costs/schlumberger-shares-rise-as-cost-cuts-impress-idUSL4N0XE44R20150417
212,SLB,QUOTEBOX-Schlumberger CEO on the effects of low oil prices,"April 17 (Reuters) - Schlumberger Ltd, the world’s No. 1 oilfield services provider, said it would cut a further 11,000 jobs and had reduced its capital spending plan for the year in anticipation of an extended lull in activity and slump in pricing. The company’s first-quarter profit beat the average analyst estimate after it exercised strict cost controls. Schlumberger executives spoke to analysts on a conference call on Friday, a day after the company reported. Here is a selection of comments from Chief Executive Paal Kibsgaard: “The pace and magnitude of the activity reductions, particularly in North America, has been almost unprecedented and we have to go back to the mid-1980s to find anything similar.” “In the U.S. Gulf of Mexico, deepwater activity was resilient in the first quarter, although we’re seeing a steady change in service mix from exploration towards development work, driven by budget cuts from most of our customers.” “Market pricing for certain products and services (in North America) has already reached unsustainable levels. However, we’re being selective in the pursuit of market share and very disciplined in the avoidance of loss-making contracts.” “In terms of managing the pricing pressure, we remain fully focused on navigating the commercial landscape by carefully balancing the pursuit of market share with the protection of operating margins and by always aiming to trade any pricing concessions for additional work scope or better contract terms.” “Looking at the industry as a whole, the current financial challenges will not disappear, even if oil prices were to recover to the levels seen in recent years. The industry is therefore forced to seek new ways of working together to reduce costs and create more project value.” “We expect the largest E&P; (exploration and production) investments to occur in North America, where 2015 spend is expected to be down by more than 30 percent. We further believe our recovery in U.S. land drilling activity will be pushed out in time as the inventory of uncompleted wells drilled and the refracturing market expand. We also anticipate our recovery in North America land activity will fall well short of reaching previous levels.” “In the international market, we expect 2015 E&P; spend to fall around 16 percent, which will create challenges in terms of activity and pricing levels, but considerably less than the headwinds seen in North America.” “I’d say there are thousands of wells in North America land that are candidates for refracturing and this is both shale liquids and shale gas.” “... The pricing concessions that are currently being given, we unfortunately are going to have to live with for a while, because it’s going to be a pretty significant overcapacity for all sorts of services given the lower activity level ...”   (Reporting by Anet Josline Pinto and Swetha Gopinath in Bengaluru)",4172015,http://www.reuters.com/article/schlumberger-nv-costs-ceo/quotebox-schlumberger-ceo-on-the-effects-of-low-oil-prices-idUSL4N0XE47V20150417
213,SLB,Lower cost cuts at Halliburton may give Schlumberger near-term edge,"(Reuters) - Halliburton Co’s decision to cut fewer jobs and keep its logistics network intact to capitalize on its pending merger with Baker Hughes Inc could give Schlumberger NV an edge at a time when cost cuts look like the best way forward. Halliburton is sticking to an “elevated cost structure” as it bets on its capacity to take on more work as a bigger company once the $35 billion deal closes, a move that could cost the company a 2-3 percent decline in near-time margins. But work itself is scarce, with oil producers doubling down for a long downturn in the North American shale industry, which has been crippled due to a slump in global oil prices. Schlumberger, the world’s No.1 oilfield services provider, recently wooed shareholders with 11,000 job cuts, in addition to the 9,000 announced earlier. In comparison, Halliburton has cut 9,000 jobs. “I think in the very near term, Schlumberger is going to make more money than Halliburton because it’s not carrying the extra cost,” said BMO Capital Markets analyst Daniel Boyd. Moreover, higher costs will hinder Halliburton’s ability to take on Schlumberger in international markets, which have been more resilient to the drop in crude prices. “By leveraging both its technological and cost advantages, I think Schlumberger has the opportunity to take share in areas that are not a primary focus for Halliburton and Baker Hughes,” said Tigress Financial Partners analyst Philip Van Deusen. But both Boyd and Deusen said Halliburton stands to gain in the longer term because of the deal due to benefits from synergies. Halliburton has said it expects the Baker Hughes deal to result in annual costs savings of about $2 billion. “... in a typical downturn we would have reduced our operating cost structure more than we have done ...,” Halliburton Chief Operating Officer Jeffrey Miller said on a post-earnings call on Monday. “While this decision burdens current margins, it is clearly the right thing to do in the long run.” Halliburton’s margins in the January-March quarter slid more than 11 percentage points from the October-December period, according to Barclays, while Schlumberger’s margins fell by 6.7 percentage points. “Schlumberger’s margins in North America will likely be higher than Halliburton’s during the downturn,” said Evercore ISI analyst James West. Still, margins at both companies were ahead of the estimates of most analysts tracked by Reuters. ",4202015,http://www.reuters.com/article/us-halliburton-results-costs/lower-cost-cuts-at-halliburton-may-give-schlumberger-near-term-edge-idUSKBN0NB2BP20150420
214,SLB,Lower cost cuts at Halliburton may give Schlumberger near-term edge,"April 20 (Reuters) - Halliburton Co’s decision to cut fewer jobs and keep its logistics network intact to capitalize on its pending merger with Baker Hughes Inc  could give Schlumberger NV an edge at a time when cost cuts look like the best way forward. Halliburton is sticking to an “elevated cost structure” as it bets on its capacity to take on more work as a bigger company once the $35 billion deal closes, a move that could cost the company a 2-3 percent decline in near-time margins. But work itself is scarce, with oil producers doubling down for a long downturn in the North American shale industry, which has been crippled due to a slump in global oil prices  . Schlumberger, the world’s No.1 oilfield services provider, recently wooed shareholders with 11,000 job cuts, in addition to the 9,000 announced earlier. In comparison, Halliburton has cut 9,000 jobs. “I think in the very near term, Schlumberger is going to make more money than Halliburton because it’s not carrying the extra cost,” said BMO Capital Markets analyst Daniel Boyd. Moreover, higher costs will hinder Halliburton’s ability to take on Schlumberger in international markets, which have been more resilient to the drop in crude prices. “By leveraging both its technological and cost advantages, I think Schlumberger has the opportunity to take share in areas that are not a primary focus for Halliburton and Baker Hughes,” said Tigress Financial Partners analyst Philip Van Deusen. But both Boyd and Deusen said Halliburton stands to gain in the longer term because of the deal due to benefits from synergies. Halliburton has said it expects the Baker Hughes deal to result in annual costs savings of about $2 billion. “... in a typical downturn we would have reduced our operating cost structure more than we have done ...,” Halliburton Chief Operating Officer Jeffrey Miller said on a post-earnings call on Monday. “While this decision burdens current margins, it is clearly the right thing to do in the long run.” Halliburton’s margins in the January-March quarter slid more than 11 percentage points from the October-December period, according to Barclays, while Schlumberger’s margins fell by 6.7 percentage points. “Schlumberger’s margins in North America will likely be higher than Halliburton’s during the downturn,” said Evercore ISI analyst James West. Still, margins at both companies were ahead of the estimates of most analysts tracked by Reuters.   (Additional reporting by Sneha Banerjee and Kanika Sikka in Bengaluru; Editing by Sayantani Ghosh and Saumyadeb Chakrabarty)",4202015,http://www.reuters.com/article/halliburton-results-costs/lower-cost-cuts-at-halliburton-may-give-schlumberger-near-term-edge-idUSL4N0XH57G20150420
215,SLB,WRAPUP 2-Weak U.S. business spending data hints at sluggish growth rebound,"(Adds details, analyst comments, updates markets) * Core capital goods orders fall 0.5 percent in March * Core capital goods shipments slip 0.4 percent * Durable goods orders jump 4.0 percent on transportation By Lucia Mutikani WASHINGTON, April 24 (Reuters) - U.S. business investment spending plans fell for a seventh straight month in March, weighed down by a strong dollar and lower energy prices, suggesting the economy was struggling to rebound from a recent soft patch. The report from the Commerce Department on Friday came on the heels of lukewarm data on retail sales, employment and housing starts that have hinted at insufficient growth momentum that could prompt the Federal Reserve to delay raising interest rates until later this year. “This is consistent with a sluggish rebound in growth. It’s shedding more doubt on the Fed’s willingness to raise rates mid-year,” said Gennadiy Goldberg, an economist at TD Securities in New York. Non-defense capital goods orders excluding aircraft, a closely watched proxy for business spending plans, declined 0.5 percent last month after a revised 2.2 percent drop in February, which was the biggest decline since July 2013. The so-called core capital goods orders were previously reported to have declined 1.1 percent in February. Economists had forecast these orders gaining 0.3 percent last month. The weakness mirrors other manufacturing indicators such as industrial production and various regional factory surveys. The dollar fell against a basket of currencies after the report, while prices for U.S. government debt rose. U.S. stocks were trading marginally higher as investors were cheered by strong results from Google Inc, Amazon.com Inc  and Microsoft Corp. The Fed has kept overnight interest rates near zero since December 2008, but a number of officials have said an increase will likely be considered at its June policy-setting meeting. Manufacturing has been undermined by the buoyant dollar, whose 12.1 percent appreciation against the currencies of the United States’ main trading partners since last June has eroded overseas profits of multinational companies like Procter & Gamble Co. The world’s largest household products maker on Thursday reported a 8.3 percent decline in quarterly sales. In addition, lower energy prices have cut into domestic oil production, reducing demand for equipment by oil-field companies, including Schlumberger and Halliburton . Schlumberger, the world’s No.1 oil-field services provider, has cut its capital expenditure plans for this year by about $500 million to $2.5 billion. Halliburton slashed its capex by about 15 percent to $2.8 billion. “Cheap oil and a strong dollar, while beneficial to consumers, are putting serious pressure on manufacturers,” said Jay Morelock, an economist at FTN Financial in New York. The dollar and reduced capex spending by oil-field firms combined with a harsh winter and softer global demand to slow U.S. growth at the start of the year. In March, shipments of core capital goods - which are used to calculate equipment spending in the government’s gross domestic product measurement - fell 0.4 percent after a downwardly revised 0.1 percent gain in February. Shipments in February were previously reported to have risen 0.3 percent. As a result, JPMorgan lowered its first-quarter GDP growth estimate by one-tenth of a percentage point to a 0.6 percent annual pace. Barclays trimmed its forecast to a 1.1 percent rate from a 1.2 percent pace. The economy expanded at a 2.2 percent pace in the fourth quarter. The government will publish its snapshot of first-quarter GDP next Wednesday. Pointing to prolonged weakness in manufacturing, which accounts for about 12 percent of the U.S. economy, unfilled orders for core capital goods fell for a second straight month in March after barely rising in January. “We have not seen the full ramifications of the strong dollar and the drop in oil-related investment, so that could continue to play out,” said Thomas Costerg, a U.S. economist at Standard Chartered Bank in New York. “The focus is now on services and consumers in the hope that they are going to pick up the tab. So far we are not seeing signs of that.” A surge in transportation equipment buoyed overall orders for durable goods - items ranging from toasters to aircraft that are meant to last three years or more - which rebounded 4.0 percent last month. That was the largest increase since July last year and followed a 1.4 percent decline in February. ",4242015,http://www.reuters.com/article/usa-economy/wrapup-2-weak-u-s-business-spending-data-hints-at-sluggish-growth-rebound-idUSL1N0XL0OC20150424
