97,SLB,UPDATE 2-Schlumberger says North America weaker than expected in Q1,"(Adds background on rig count, earnings; updates shares) By Braden Reddall March 18 (Reuters) - Schlumberger Ltd, the world’s largest oilfield services company, warned on Monday that North American activity was weaker than expected in the first quarter as U.S. drillers returned to work at a slower pace than the company predicted. Shares of Schlumberger fell 2.6 percent to $77.34 in morning trading on the New York Stock Exchange. Schlumberger Chief Executive Paal Kibsgaard on Monday said asset utilization recovered from a holiday slowdown and that the lower cost of a key hydraulic fracturing ingredient, guar, was providing some relief. But pricing remains the fundamental issue, he added. “We continue to see negative pricing pressure in many product lines in the first quarter, with active participation from our principal competitors, reinforcing the somewhat unclear outlook for the North America land market at this stage,” he said in a speech at the Howard Weil energy conference in New Orleans. Schlumberger, with an extensive international reach, is less exposed to North America than rivals Halliburton Co and Baker Hughes Inc. The North American natural gas glut has forced many drillers to shut down rigs until gas prices recover. Kibsgaard raised a few eyebrows among analysts with a prediction in January that between 100 and 150 U.S. rigs could go back to work in the first quarter - a quicker recovery than many others had anticipated. As of the end of last week, the total number of U.S. rigs working had increased by 13 so far in the first quarter to 1,776, according to a closely watched tally by Baker Hughes. Analysts at Tudor Pickering Holt said on Monday the rig count looked to be generally trending higher given “healthy crude oil prices” and the natural gas rig count bottoming out, and they saw oilfield services stocks as a good bet over this year even if they were “ripe for a short-term breather.” Looking offshore, Kibsgaard said on Monday that Gulf of Mexico activity had been temporarily affected by the replacement of subsea connector bolts on some rigs there. Last month, U.S. regulators told rig contractors to inspect the bolts, made by General Electric Co, after a leak. Schlumberger maintained its goal of double-digit earnings growth for 2013, assuming North America land activity and pricing levels come in line with expectations and that it reaches a solution in Venezuela, where it saw a significant slowdown in the rates of payments by customers last quarter. Analysts had been expecting earnings per share growth of 14 percent to $4.74 in 2013, according to the average on Thomson Reuters I/B/E/S. Among international markets, Kibsgaard highlighted Saudi Arabia, Iraq, Russia, China and Africa. The Saudi rig count would reach 170 by the end of this year, he said, raising the estimate by 10 rigs from his forecast in January. In Iraq, where the oilfield services industry has been investing for years in anticipation of growth, Kibsgaard expected 2013 revenue of $600 million and good profitability. As for all the unconventional resources unlocked by hydraulic fracturing, he said North America would remain the center of activity, especially in oil, and the short-term focus outside the region would be on pilot projects. “Activity and production will likely start to become more meaningful in the second half of this decade,” he said of global unconventionals. ",3182013,http://www.reuters.com/article/schlumberger-outlook/update-2-schlumberger-says-north-america-weaker-than-expected-in-q1-idUSL1N0CA2R220130318
98,SLB,Schlumberger says Q1 North America activity weaker than expected,"March 18 (Reuters) - Schlumberger Ltd, the world’s largest oilfield services company, warned on Monday that North American activity was coming in lower than expected in the first quarter, as fewer rigs were going back to work than it had expected. Shares of Schlumberger fell 2.5 percent to $77.40 in early trading on the New York Stock Exchange. In a copy of a speech delivered by Chief Executive Paal Kibsgaard on Monday, Schlumberger said asset utilization had recovered from a holiday slowdown and lower cost of a key hydraulic fracturing ingredient, guar, was providing some relief. But pricing remains the fundamental issue, he added. “We continue to see negative pricing pressure in many product lines in the first quarter, with active participation from our principal competitors, reinforcing the somewhat unclear outlook for the North America land market at this stage,” Kibsgaard said in the speech to the Howard Weil energy conference in New Orleans. ",3182013,http://www.reuters.com/article/schlumberger-outlook/schlumberger-says-q1-north-america-activity-weaker-than-expected-idUSL1N0CA2O620130318
99,SLB,BRIEF-Schlumberger CEO says Q1 N.America activity below expectations,"March 18 (Reuters) - Schlumberger NV :  * CEO says international unconventional resource plays to become more meaningful in 2nd half of this decade  * CEO says Saudi Arabia rig count set to reach around 170 by end of 2013 - text of speech  * CEO says says expects to generate $600 million in revenue in Iraq this year, with good profitability - text of speech  * CEO says strongest growth in China to come from offshore areas and complex conventional land projects - speech  * CEO says Q1 North America activity below expectations as customers reactivate fewer rigs than expected - speech  * CEO says sees negative pricing pressure in many North America product lines, reinforcing unclear outlook on land  * CEO says Gulf of Mexico activity temporarily impacted by delay with replacement of subsea connector bolts",3182013,http://www.reuters.com/article/schlumberger-outlook/brief-schlumberger-ceo-says-q1-n-america-activity-below-expectations-idUSWEN0086Q20130318
100,SLB,Schlumberger CEO: Venezuela debt collections improving,"NEW YORK (Reuters) - Oil services giant Schlumberger Ltd (SLB.N) has improved its ability to collect the money it is owed by Venezuela’s state oil company PDVSA and will now be able to recognize all revenue associated with its first-quarter operations in the country, Schlumberger’s CEO said on Sunday. Schlumberger Chief Executive Officer Paul Kibsgaard’s announcement, published in a press release, follows a warning from the company earlier in March that Venezuelan customers’ rates of payment had dropped sharply. “After meetings with PDVSA, the collections have improved to the point that we will recognize all revenue associated with our first-quarter operations,” Kibsgaard said in the release. Kibsgaard did not provide any specific information in the statement on how much Schlumberger would collect. “We further expect to finalize a new payment agreement with PDVSA and we anticipate ramping up activity to meet the current and future needs of PDVSA’s development and production plans,” he added. In a March 18 speech, Kibsgaard said Schlumberger was maintaining its forecast for double-digit earnings growth in 2013 but that it was partially contingent upon reaching a solution in Venezuela. PDVSA has faced mounting debts since the 2008 financial crisis. Venezuela’s oil minister Rafael Ramirez told reporters on March 22 PDVSA owed a total of $16.5 billion to service providers. Ramirez, who is also PDVSA’s president, said the state-owned company was working to set up financing arrangements to help pay off its debts to Schlumberger to keep the oilfield services provider from pulling out of the country. (This story corrects context of March 18 forecast to reflect it was given in a speech by the CEO, not an earnings report) ",3312013,http://www.reuters.com/article/us-schlumberger-venezuela-payments/schlumberger-ceo-venezuela-debt-collections-improving-idUSBRE92U08120130331
101,SLB,CORRECTED-Schlumberger CEO: Venezuela debt collections improving,"(Corrects context of March 18 forecast to reflect it was given in a speech by the CEO, not an earnings report) NEW YORK, March 31 (Reuters) - Oil services giant Schlumberger Ltd has improved its ability to collect the money it is owed by Venezuela’s state oil company PDVSA and will now be able to recognize all revenue associated with its first-quarter operations in the country, Schlumberger’s CEO said on Sunday. Schlumberger Chief Executive Officer Paul Kibsgaard’s announcement, published in a press release, follows a warning from the company earlier in March that Venezuelan customers’ rates of payment had dropped sharply. “After meetings with PDVSA, the collections have improved to the point that we will recognize all revenue associated with our first-quarter operations,” Kibsgaard said in the release. Kibsgaard did not provide any specific information in the statement on how much Schlumberger would collect. “We further expect to finalize a new payment agreement with PDVSA and we anticipate ramping up activity to meet the current and future needs of PDVSA’s development and production plans,” he added. In a March 18 speech, Kibsgaard said Schlumberger was maintaining its forecast for double-digit earnings growth in 2013 but that it was partially contingent upon reaching a solution in Venezuela. PDVSA has faced mounting debts since the 2008 financial crisis. Venezuela’s oil minister Rafael Ramirez told reporters on March 22 PDVSA owed a total of $16.5 billion to service providers. Ramirez, who is also PDVSA’s president, said the state-owned company was working to set up financing arrangements to help pay off its debts to Schlumberger to keep the oilfield services provider from pulling out of the country. ",3312013,http://www.reuters.com/article/schlumberger-venezuela-payments/corrected-schlumberger-ceo-venezuela-debt-collections-improving-idUSL2N0CN0BU20130331
102,SLB,Forest Oil taps Schlumberger to develop Eagle Ford acreage,"April 12 (Reuters) - Forest Oil Corp said Schlumberger Ltd, the oilfield services sector leader, will pick up a 50 percent working interest in the oil and gas producer’s Eagle Ford shale acreage by paying $90 million towards future drilling costs. Debt-heavy Forest oil has raised $600 million from asset disposals since last July to improve liquidity. The company had $1.86 billion in debt and $1.1 million in cash and equivalents as of Dec. 31, according to Thomson Reuters data. Forest, whose cash flows have decreased due to weak natural gas prices, has turned attention to liquids output in the Texas-Oklahoma Panhandle, East Texas and Eagle Ford Shale in Texas. Forest, which will operate the Eagle Ford drilling program, expects to spend the $90 million by the end of 2014, it said in a statement on Friday. Forest expects its share of capital expenditure in the  development plan to be about $125 million in 2013, and $220 million in 2014. Beyond that, Forest and Schlumberger will share future drilling costs equally. The company plans to increase drilling to four rigs by the end of the third quarter, from one to two rigs currently. Sales volumes in 2014 are expected to scale up to 6,500 boe/d (barrels of oil equivalent per day), from 1,600 boe/d in 2012. As part of the agreement, Schlumberger will provide drilling, completion and lifting technologies and reservoir management technologies, besides other services. Forest Oil shares, which have more than halved in the past year, were marginally down at $5.00 on the New York Stock Exchange on Friday. Schlumberger’s stock was down less than 1 percent at $76.48.",4122013,http://www.reuters.com/article/forestoil-stakesale/forest-oil-taps-schlumberger-to-develop-eagle-ford-acreage-idUSL3N0CZ9VB20130412
103,SLB,EU mergers and takeovers (April 16),,4162013,http://www.reuters.com/article/eu-mergers-takeovers/eu-mergers-and-takeovers-idUSL5N0D334X20130416
104,SLB,Baker sees U.S. drilling pickup; Schlumberger cautious,,4192013,http://www.reuters.com/article/us-oilfieldservices-results/baker-sees-u-s-drilling-pickup-schlumberger-cautious-idUSBRE93I0IY20130419
105,SLB,WRAPUP 2-Baker sees U.S. drilling pickup; Schlumberger cautious,"* Baker forecasts modest increase in U.S. rig count for 2013 * Schlumberger remains cautious on North America * Both companies beat first-quarter profit estimates * Halliburton reports results on Monday By Braden Reddall April 19 (Reuters) - Signs of improvement in the depressed North American drilling market and steady growth elsewhere helped oilfield services companies Schlumberger Ltd and Baker Hughes Inc beat Wall Street’s profit expectations. Sector leader Schlumberger posted earnings above analysts’ estimates for the sixth straight quarter, lifted by strong and consistent growth in countries including Saudi Arabia, Iraq, China and Australia. Schlumberger shares were unchanged at $71 in morning trading. Cowen Securities analyst Jim Crandell said revenue in Europe and Latin America, in particular, fell short of his estimates. Third-ranked Baker Hughes’ profit also topped estimates, and the company forecast a modest increase in U.S. rig counts for 2013. As the United States starts to clear a natural gas glut created by the hydraulic fracturing revolution, prices for the fuel have improved, reducing the drag on drilling activity there. “North America took a step in the right direction,” Baker Hughes Chief Executive Officer Martin Craighead told analysts on a conference call on Friday. Baker Hughes shares were down 0.7 percent at $44.28. While overall earnings were down 30 percent from a year earlier, the company said increased drilling in Canada and a strong pumping business lifted its first-quarter profit in North America from the previous quarter. UBS analyst Angie Sedita said Baker had a solid quarter in the Middle East as well as North America, two areas of relative weakness in the past. “We expect further margin gains ahead (at a measured pace) across regions in 2013,” she wrote in a note to investors. Looking at signs that U.S. land drilling was improving, Barclays analysts said the number of permits issued in the country rose by 8 percent in March from February. Schlumberger, which said last month that North American activity was weaker than expected, said it was still uncertain about the region. Low natural gas prices had made drilling for gas uneconomical in many fields and weighed down the prices charged for services like pressure pumping, which is used in hydraulic fracturing, or fracking. Schlumberger, whose main offices are in Paris, Houston and The Hague, generated roughly two-thirds of its 2012 revenue outside North America, insulating itself from the always-volatile drilling region more than Halliburton or Baker Hughes did. Schlumberger CEO Paal Kibsgaard said the outlook for drilling activity in international markets and for liquids in North America remained “pretty solid” at current oil prices. Kibsgaard stuck with his forecast that client spending outside North America would rise 10 percent this year, lifting Schlumberger earnings by a double-digit percentage rate. Schlumberger’s first-quarter net income fell 3 percent to $1.26 billion, or 94 cents per share. Excluding items, it was $1.01 per share, while revenue rose to $10.67 billion. Analysts had expected earnings of 99 cents per share on revenue of $10.7 billion, according to Thomson Reuters I/B/E/S. Strong activity in Canada and solid results from the U.S. Gulf of Mexico only partially offset weakness in U.S. land drilling, the company said. While U.S. natural gas prices  rose 15 percent in the quarter, drilling has not yet bounced back, and gas producers have trimmed 2013 exploration budgets. As for Baker Hughes, its first-quarter net income fell to $267 million, or 60 cents per share, from $379 million, or 86 cents per share. Excluding a $23 million loss from Venezuelan currency devaluation, the company earned 65 cents per share, above Wall Street expectations of 62 cents. Revenue fell 2 percent to $5.23 billion, beating analysts’ estimates of $5.18 billion. Halliburton, the U.S. market leader and the largest fracking company, is due to report earnings on Monday.",4192013,http://www.reuters.com/article/oilfieldservices-results/wrapup-2-baker-sees-u-s-drilling-pickup-schlumberger-cautious-idUSL2N0D60RE20130419
106,SLB,"BRIEF-Schlumberger: int'l, N.American liquids outlook solid at current prices",,4192013,http://www.reuters.com/article/schlumberger-results-outlook/brief-schlumberger-intl-n-american-liquids-outlook-solid-at-current-prices-idUSWEN008I420130419
107,SLB,BRIEF-Schlumberger up in premarket after results,"NEW YORK, April 19 (Reuters) - Schlumberger NV :  * Shares up 2.2 percent in premarket trading after results",4192013,http://www.reuters.com/article/schlumberger-brief/brief-schlumberger-up-in-premarket-after-results-idUSWEN008HZ20130419
108,SLB,UPDATE 1-International operations boost Schlumberger revenue,"* Q1 adj EPS $1.01 vs est. $0.99 * Revenue rises 7.6 pct to $10.67 billion * Says outlook for North America remains uncertain April 19 (Reuters) - Schlumberger Ltd, the world’s largest oilfield services company, reported a profit that topped analysts’ estimates for the sixth straight quarter, helped by robust drilling activity outside North America. The company, which reported a 7.6 percent rise in first-quarter revenue on Friday, said it continued to see strong and consistent growth in regions such as Saudi Arabia, Iraq, China and Australia but the outlook for North America was uncertain. Schlumberger said there had been no improvement in dry gas drilling in North America, despite significant drawdowns on inventories. Weak natural gas prices have made drilling for the fuel uneconomic, bringing down the prices oilfield service companies charge for services such as pressure pumping. Schlumberger, which generated roughly two-thirds of its 2012 revenue from its international operations, is better insulated from the drilling slowdown in North America than rivals Halliburton Co and Baker Hughes Inc. Baker Hughes, the world’s third-largest oilfield services provider, reported a 30 percent fall in profit on Friday, citing weak drilling activity in North America. Schlumberger said strong activity in Canada and solid results from the U.S. Gulf of Mexico had partially offset weakness in U.S. land drilling. “International strength, in combination with resilience to challenging market conditions in North America, led to solid performance in the first quarter,” Chief Executive Paal Kibsgaard said in a statement. Although natural gas prices rose 15 percent in the first quarter, drilling has not bounced back as gas producers have trimmed exploration budgets for 2013. Schlumberger warned last month that North American activity was weaker than expected in the first quarter as U.S. drillers returned to work at a slower pace than expected. Net income fell 3.3 percent to $1.26 billion, or 94 cents per share, for the quarter ended March 31. Profit, excluding items, was $1.01 per share. Revenue rose to $10.67 billion. Analysts had expected earnings of 99 cents per share on revenue of $10.73 billion, according to Thomson Reuters I/B/E/S. Schlumberger shares closed at $71 on Thursday on the New York Stock Exchange.",4192013,http://www.reuters.com/article/schlumberger-results/update-1-international-operations-boost-schlumberger-revenue-idUSL3N0D6OPD20130419
109,SLB,REFILE-Schlumberger's profit weighed down by weak drilling in N. America,"April 19 (Reuters) - Schlumberger Ltd, the world’s largest oilfield services company, reported a 3 percent dip in quarterly profit on sluggish North American gas drilling. Natural gas-directed drilling in the United States has slowed down last year due to weak prices. Although natural gas prices rose 15 percent in the first quarter, drilling has not bounced back as gas producers have trimmed their exploration budgets for 2013. Net income fell to $1.26 billion, or 94 cents per share, for the quarter ended March 31 from $1.3 billion, or 97 cents per share, a year earlier. Revenue increased nearly 8 percent to 10.67 billion.",4192013,http://www.reuters.com/article/schlumberger-results/refile-schlumbergers-profit-weighed-down-by-weak-drilling-in-n-america-idUSL3N0D55D820130419
110,SLB,UPDATE 1-Schlumberger extends Venezuela's PDVSA $1 bln credit line,"By Deisy Buitrago MORICHAL, Venezuela, May 24 (Reuters) - Venezuela’s state oil company PDVSA will receive a revolving credit line of at least $1 billion from oil services giant Schlumberger, the OPEC nation’s oil minister said on Friday. The deal will provide some financial breathing room for PDVSA, which as of last year had built up $16.5 billion in debts to service providers as it focused on social spending at the expense of paying off industry-related debts. “What we are signing today is an agreement for a revolving credit facility...that will allow us to receive more services from Schlumberger,” said Venezuelan Oil Minister Rafael Ramirez after signing the agreement with Schlumberger Chief Executive Paal Kibsgaard. The agreement will allow PDVSA to continue contracting Schlumberger for work including drilling and pipeline services, even if it does not have cash flow to pay immediately. Service companies will be crucial to Venezuela’s efforts to boost output in the Orinoco belt, whose challenging conditions and tar-like crude require state-of-the-art technology to ensure cost-efficient production. The deal is also important for Schlumberger, which is increasingly relying on state-run oil companies as a source of revenue. Ramirez and Kibsgaard were visiting Orinoco oil belt installations in eastern Venezuela. The agreement appeared to ease tensions between PDVSA and Schlumberger, the world’s top oil services provider, over unpaid debts that began piling up after the global financial crisis. “Our company has been in Venezuela since 1929, more than 80 years, and we have intention of staying in Venezuela for another 200 years,” said Kibsgaard. The deal comes on the heels of recent financing agreements with Chinese and Russian oil companies that will provide $5.5 billion in financing for Orinoco belt joint ventures. PDVSA and Schlumberger also signed an agreement for an oil services joint venture. That marks an unusual step for a service company, which generally operates as a contractor rather than an oilfield partner. It also appears to run counter to Schlumberger’s 2011 decision to sell its rig management business as it sharpened focus on providing services for rigs instead of owning them. PDVSA in 2012 targeted a 500,000 barrel per day (bpd) production increase that was to take the country’s output to 3.5 million bpd through greater Orinoco oil output. But crude production for the year slipped slightly to 2.9  million bpd amid chronic delays in project start-up and PDVSA’s lack of cash flow that prevented it from making investments. The official 2013 target is an increase of 400,000 bpd to reach 3.3 million bpd. PDVSA under the presidency of late socialist leader Hugo Chavez became the primary financier of generous social development programs, helping make Chavez a hero to many but at times leaving oilfield operations underfunded.",5242013,http://www.reuters.com/article/venezuela-schlumberger/update-1-schlumberger-extends-venezuelas-pdvsa-1-bln-credit-line-idUSL2N0E51MA20130524
