1,SO,"EPA rule aims to cut smog, soot from coal plants","WASHINGTON (Reuters) - U.S. environmental regulators finalized a rule on Thursday to slash air pollution from coal-fired power plants in 27 states east of the Rocky Mountains that result in unhealthy levels of smog and soot.  The Environmental Protection Agency measure, known as the Cross State Air Pollution Rule, will add costs for some power generators, but should cut health care bills for Americans.  Companies that could see higher costs include large coal burners Southern Co, Duke Energy and American Electric Power.  “No community should have to bear the burden of another community’s polluters, or be powerless to prevent air pollution that leads to asthma, heart attacks and other harmful illnesses,” said EPA Administrator Lisa Jackson.  The EPA rule will reduce power plant sulfur dioxide emissions by 73 percent by 2014, from 2005 levels, when combined with state environmental laws. It will cut nitrogen oxide emissions by 54 percent by 2014. Those cuts are slightly deeper than ones proposed by the EPA last year.  Power plants have to start cutting their sulfur dioxide emissions in January 2012 and their nitrogen oxide emissions that May.  In addition, the state of Texas will now be required to cut sulfur dioxide emissions in an annual program, a measure that was not included in last year’s proposal.  The agency said the rule would prevent up to 34,000 premature deaths, and save $280 billion per year in health costs. The pollution is linked to heart attacks and lung problems including asthma.  Those benefits outweigh the $800 million projected to be spent by power plants and others annually on the rule in 2014 and the roughly $1.6 billion per year in capital investments already underway from previous rules, the EPA said.  The rule will also level the playing field for power plant operators that are already controlling these emissions by requiring more plants to take similar actions, it said.  Not everyone was happy about the regulation.  “The late decision to apply the rule to Texas and the modeling for the rule have resulted in wholly unreasonable mandates and unrealistic timelines for Texas,” Luminant, a unit of private company Energy Future Holdings, and the biggest power producer in Texas, said in a release.  Shares of Southern Co were down 0.4 percent on Thursday, while Duke Energy and American Electric Power both rose less than 0.5 percent.  The rule resulted from a federal appeals court order instructing the EPA to strengthen a similar regulation issued in 2005 by the  Bush administration.  It is opposed by many Republicans in Congress, who say it will kill jobs and could make transmission of electricity unreliable because it would force companies to shut some of their coal plants.  But the argument that the rule will hurt transmission is a “red herring” because plants integral to power delivery would not be allowed to shut down, said Susan Tierney, a managing principal at the Analysis Group, an organization of economic and financial consultants.  She said only the oldest, least efficient and smaller coal plants would be shut as a result of rules to be issued this year by the EPA on power plants.  Environmentalists praised the EPA. The Clean Air Task Force said the rule was a “solid victory for clean air and public health.”  The EPA will take public comment for 45 days on a supplemental rule that would require six states — Iowa, Kansas, Michigan, Missouri, Oklahoma and Wisconsin — to reduce nitrogen oxide pollution in the summer months. That rule is expected to be finalized late this year.  ",7072011,http://www.reuters.com/article/us-usa-epa-smog/epa-rule-aims-to-cut-smog-soot-from-coal-plants-idUSTRE7664GD20110707
2,SO,"UPDATE 2-US rule aims to cut smog, soot from coal plants"," * Power plants have to start cutting emissions in 2012  * Clean air rule would prevent up to 34,000 deaths  * Republican lawmakers say EPA rule would kill jobs  * Rule makes Texas cut sulfur dioxide annually  (Adds power producer comments, details of rule)  By Timothy Gardner and Tom Doggett  WASHINGTON, July 7 (Reuters) - U.S. environmental regulators finalized a rule on Thursday to slash air pollution from coal-fired power plants in 27 states east of the Rocky Mountains that result in unhealthy levels of smog and soot.  The Environmental Protection Agency measure, known as the Cross State Air Pollution Rule, will add costs for some power generators, but should cut health care bills for Americans.  Companies that could see higher costs include large coal burners Southern Co (SO.N), Duke Energy (DUK.N) and American Electric Power (AEP.N).  “No community should have to bear the burden of another community’s polluters, or be powerless to prevent air pollution that leads to asthma, heart attacks and other harmful illnesses,” said EPA Administrator Lisa Jackson.  The EPA rule will reduce power plant sulfur dioxide emissions by 73 percent by 2014, from 2005 levels, when combined with state environmental laws. It will cut nitrogen oxide emissions by 54 percent by 2014. Those cuts are slightly deeper than ones proposed by the EPA last year.  <^^^^^^^^^^^^^^^^^^^^^^^^^^^^^^^^^^^^^^^^^^^^^^^^^^^^^^^^^  US extends time on toxics rule          [ID:nN1E75K157]  EPA delays rollout of CO2 rule          [ID:nN13140609]  FACTBOX-US Coal units to retire         [ID:nN28243671]  ^^^^^^^^^^^^^^^^^^^^^^^^^^^^^^^^^^^^^^^^^^^^^^^^^^^^^^^^^>  STEEP COSTS, BUT HEALTH BENEFITS  Power plants have to start cutting their sulfur dioxide emissions in January 2012 and their nitrogen oxide emissions that May.  In addition, the state of Texas will now be required to cut sulfur dioxide emissions in an annual program, a measure that was not included in last year’s proposal.  The agency said the rule would prevent up to 34,000 premature deaths, and save $280 billion per year in health costs. The pollution is linked to heart attacks and lung problems including asthma.  Those benefits outweigh the $800 million projected to be spent by power plants and others annually on the rule in 2014 and the roughly $1.6 billion per year in capital investments already underway from previous rules, the EPA said.  The rule will also level the playing field for power plant operators that are already controlling these emissions by requiring more plants to take similar actions, it said.  Not everyone was happy about the regulation.  “The late decision to apply the rule to Texas and the modeling for the rule have resulted in wholly unreasonable mandates and unrealistic timelines for Texas,” Luminant, a unit of private company Energy Future Holdings, and the biggest power producer in Texas, said in a release.  Shares of Southern Co were down 0.4 percent on Thursday, while Duke Energy and American Electric Power both rose less than 0.5 percent.  RED HERRING  The rule resulted from a federal appeals court order instructing the EPA to strengthen a similar regulation issued in 2005 by the the Bush administration.  It is opposed by many Republicans in Congress, who say it will kill jobs and could make transmission of electricity unreliable because it would force companies to shut some of their coal plants.  But the argument that the rule will hurt transmission is a “red herring” because plants integral to power delivery would not be allowed to shut down, said Susan Tierney, a managing principal at the Analysis Group, an organization of economic and financial consultants.  She said only the oldest, least efficient and smaller coal plants would be shut as a result of rules to be issued this year by the EPA on power plants.  Environmentalists praised the EPA. The Clean Air Task Force said the rule was a “solid victory for clean air and public health.”  The EPA will take public comment for 45 days on a supplemental rule that would require six states — Iowa, Kansas, Michigan, Missouri, Oklahoma and Wisconsin —  to reduce nitrogen oxide pollution in the summer months. That rule is expected to be finalized late this year.  (Additional reporting by Eileen O’Grady in Houston; Editing by David Gregorio and Lisa Shumaker)   ",7072011,http://www.reuters.com/article/usa-epa-smog/update-2-us-rule-aims-to-cut-smog-soot-from-coal-plants-idUSN1E7660XM20110707
3,SO,"Analysis:After Japan, slow change seen for U.S. nuclear industry","WASHINGTON/HOUSTON (Reuters) - The U.S. nuclear industry this week gets its first peek at a roadmap for new regulations that ultimately could cost it billions in the wake of Japan’s Fukushima Daiichi disaster.  But the bottom-line impact of Fukushima on the U.S. fleet of 104 reactors could take most of the next decade to calculate.  Most expect Tuesday’s report from a task force of senior staff members at the Nuclear Regulatory Commission to be just the first step in years of deliberation and rule-making to ensure U.S. plants can better withstand catastrophes like the March earthquake and tsunami that wrecked the Fukushima plant.  The head of the U.S. NRC has said he wants the agency to move as fast as it can to ensure the world’s largest nuclear power producer can withstand catastrophes.  The last time the commission carried out such regulatory soul-searching — after the September 11, 2001 attacks — it took a decade to get the entire plan in place.  After Fukushima, the world’s worst nuclear accident in 25 years, the NRC is expected to step up requirements for U.S. plants to be able keep running even if they lose power for days or weeks.  “I do think that the industry is expecting to make some changes that will cost a great deal of money,” said Craven Crowell, a former chairman of the Tennessee Valley Authority, a government-owned utility, who has worked in the nuclear industry for more than 30 years.  The changes could be expensive for plant owners, such as Exelon, Entergy and PG&E, and could affect the first new plants planned in 30 years — Southern Co’s Vogtle plant in Georgia and SCANA Corp’s facility in South Carolina.  It will take time for NRC staff and the five-member commission to agree on the detailed changes needed, and send those changes through the tortuous rule-making process.  “In general, we’re probably looking at a two- to three-year timeframe, at least,” said Daniel Stenger, a partner in the Washington, D.C. office of law firm Hogan Lovells that focuses on nuclear energy.  The sometimes-fractious commission will need to find consensus to move forward. Commissioners are slated to give their first public statements on the task force recommendations at a public hearing on July 19.  NRC Chairman Gregory Jaczko, seen as the most activist member of the commission, has urged an expedited timeline.  “It, I think, will not be acceptable if 10 years from now we’re still working through the recommendations of this task force,” Jaczko said at a May hearing.  The NRC last overhauled its rules after the September 11, 2001 attacks, when plants were seen as potential targets. It took until 2009 for the agency to finalize a comprehensive set of rules, and one regulation concerning emergency preparedness has yet to be finalized.  Almost 10 years later, a dozen of the 64 nuclear power stations in the country are still working to comply with the rules, according to NRC records.  “There is no question that the nuclear industry dragged its feet after 9/11 in implementing the security upgrades needed to adequately protect their plants against terrorist attacks,” said Edwin Lyman of the Union of Concerned Scientists, a group that advocates for nuclear safety.  NRC officials said that while the beefed-up security measures took years to finalize, interim safety measures were already in place at nuclear facilities around the country.  “We took a full array of comprehensive, substantial steps that were in place by October 2004 in direct response to NRC requirements within the deadline that was established at the time,” said Steve Kerekes, a spokesman for the industry’s trade group, the Nuclear Energy Institute.  The 1986 Chernobyl disaster led to little U.S. industry change due to major design differences between U.S. plants and the Russian reactor that lacked safety features, accident alert procedures and close regulation.  After the Three Mile Island nuclear accident in 1979, President Jimmy Carter appointed a 12-member commission within two weeks to study and recommend changes for plants.  That work took about 18 months, but some of the changes were later found to be unnecessary and counterproductive.  The industry created a peer-review group, the Institute of Nuclear Power Operations, to raise safety standards. INPO has been suggested as a model for a global nuclear enforcement agency after Fukushima.  It took about a decade before the industry and regulator fully understood what happened at Three Mile Island, recalled Margaret Harding, a former vice president at GE-Hitachi responsible for engineering quality.  It will take years before all the details of the Fukushima disaster are fully understood, and some of the most technical changes may need to wait until the jury is in, Harding said.  “It’s kind of like recalling cars without knowing what’s wrong,” said Harding, now an industry consultant.  But the NRC does not need to wait for all the details on the disaster to know that it needs to examine how well-equipped plants are to withstand a long-term power blackout, she said.  “Our expectation is that it’s going to take years to fully digest and discern lessons from Japan,” the NEI’s Kerekes said. “That doesn’t mean we are waiting; we’ve already taken numerous steps and we will continue to do that.”  The release of the task force report is expected to kick off a second, more detailed six-month review in which the public and the industry can share their views with the NRC.  The NRC has so far ignored public calls to hold off on renewing operating licenses for aging plants and making decisions on new reactor designs until the Fukushima reviews are complete.  “We want a procedure set up so that new licenses and renewed licenses are not approved unless there’s an opportunity for public participation,” said Diane Curran, a public interest lawyer in Washington who has represented groups fighting power plants for 30 years.  The NRC needs to take its time to examine fully whether its rules and inspections need to be ratcheted up to deal with disasters that go beyond the “design basis” that plants are currently required to live up to, Curran said.  “It does seem to be one of the lessons of the Fukushima accident that the whole regulatory program needs to shift,” she said.  ",7112011,http://www.reuters.com/article/us-usa-nuclear-taskforce/analysisafter-japan-slow-change-seen-for-u-s-nuclear-industry-idUSTRE76A0GV20110711
4,SO,FACTBOX-U.S. proposed new nuclear power reactors," July 13 (Reuters) - The U.S. nuclear industry’s top cop is to weigh major changes in how it regulates the country’s 104 reactors after Japan’s Fukushima disaster, a move that will help shape the future of the power source and could lead to significant cost increases.  A task force recommended the Nuclear Regulatory Commission look at a fundamental shift in how it plans for catastrophes like the earthquake and tsunami that swamped the Fukushima plant in March, the world’s worst nuclear disaster in 25 years.  Now it is up to the five-member commission to decide which ideas to accept and how quickly to proceed in an industry where plant retrofits can run into the millions. [ID:nN1E76C0KV]  The task force praised new reactors that include passive features, saying the new designs would be in line with many of its recommendations. It urged the NRC to complete its review “without delay” of Toshiba-Shaw’s Westinghouse AP1000 reactor and GE-Hitachi’s Economic Simplified Boiling Water Reactor (ESBWR). [ID:nN1E76B22X]  The AP1000 is the reactor design of choice for the nation’s first new nuclear plants in 30 years — Southern in Georgia and SCANA in South Carolina.  The following lists the NRC’s schedule for deciding the combined construction and operating license applications for new reactors: REACTOR(S)          COMPANY           DESIGN     STATE   DECISION Summer (2)          Scana (SCG.N)     AP1000      SC       2011 Vogtle (2)          Southern (SO.N)   AP1000      GA       2011 South Texas (2)     STP (NRG.N)       ABWR        TX       2011 Bellefonte (2)      TVA               AP1000      AL       2012 Levy (2)            Progress PGN.N  AP1000      FL       2012 Bell Bend (1)       PPL (PPL.N)       EPR         PA       2012 Lee (2)             Duke (DUK.N)      AP1000      SC      2012/13 Turkey Point (2)    NextEra (NEE.N)   AP1000      FL      2012/13 Calvert Cliffs (1)  UniStar (EDF.PA)  EPR         MD       2013 Fermi (1)           DTE (DTE.N)       ESBWR       MI       2013 North Anna (1)      Dominion (D.N)    USAPWR      VA       2013 Harris (2)          Progress          AP1000      NC       2014 Callaway (1)        Ameren (AEE.N)    EPR         MO  Suspended 2009 Nine Mile Pt (1)    UniStar           EPR         NY  Suspended 2009 Grand Gulf (1)      Entergy (ETR.N)   ESBWR       MS  Suspended 2009 River Bend (1)      Entergy           ESBWR       LA  Suspended 2009 —————————————————————————————— Reactor Designs ABWR - Advanced Boiling Water Reactor built by Toshiba (6502.T) AP1000 - Advanced Passive 1000 built by Westinghouse Electric, which is majority owned by Toshiba and Shaw Group SHAW.N EPR - Evolutionary Power Reactor built by Areva CEPFi.PA ESBWR - Economic Simplified Boiling Water Reactor built by General Electric (GE.N)-Hitachi (6501.T) USAPWR - U.S. Advanced Pressurized Water Reactor built by Mitsubishi Heavy Industries (7011.T)  (Reporting by Scott DiSavino in New York, Eileen O’Grady in Houston and Roberta Rampton in Washington; Editing by Lisa Shumaker)      ",7132011,http://www.reuters.com/article/usa-nuclear-reactors-new/factbox-u-s-proposed-new-nuclear-power-reactors-idUSN1E76C16I20110713
5,SO,RPT-FACTBOX-U.S. nuclear reactors similar to Fukushima," (Repeats to fix technical problem. No change to text)  July 13 (Reuters) - The U.S. nuclear industry’s top cop is to weigh major changes in how it regulates the country’s 104 reactors after Japan’s Fukushima disaster, a move that will help shape the future of the power source and could lead to significant cost increases.  A task force recommended the Nuclear Regulatory Commission look at a fundamental shift in how it plans for catastrophes like the earthquake and tsunami that swamped the Fukushima plant in March, the world’s worst nuclear disaster in 25 years.  Now it is up to the five-member commission to decide which ideas to accept and how quickly to proceed in an industry where plant retrofits can run into the millions. [ID:nN1E76C0KV]  The NRC task force recommended requiring reliable hardened vent designs in boiling water reactors with the General Electric (GE.N) designed Mark I and Mark II containment types, the same as the damaged Fukushima reactors.  In the United States, 31 of the 104 operating reactors have the Mark I or Mark II containment type. The following lists those reactors, according to data from the NRC: Reactor            Location            Size (MW)     Year    Design TVA Browns Ferry 1     Decatur, AL           1065        1974    Mark I Browns Ferry 2     Decatur, AL           1104        1975    Mark I Browns Ferry 3     Decatur, AL           1105        1977    Mark I PROGRESS ENERGY PGN.N Brunswick 1        Southport, NC          938        1977    Mark I Brunswick 2        Southport, NC          920        1975    Mark I ENERGY NORTHWEST Columbia           Richland, WA          1190        1984    Mark II NEBRASKA PUBLIC POWER DISTRICT Cooper             Nebraska City, NE      770        1974    Mark I EXELON (EXC.N) Dresden 2          Morris, IL             867        1970    Mark I Dresden 3          Morris, IL             867        1971    Mark I LaSalle 1          Marseilles, IL        1118        1982    Mark II LaSalle 2          Marseilles, IL        1120        1983    Mark II Limerick 1         Limerick, PA          1134        1985    Mark II Limerick 2         Limerick, PA          1134        1989    Mark II Oyster Creek       Toms River, NJ         615        1969    Mark I Peach Bottom 2     Lancaster, PA         1112        1974    Mark I Peach Bottom 3     Lancaster, PA         1112        1974    Mark I Quad Cities 1      Moline, IL             867        1972    Mark I Quad Cities 2      Moline, IL             867        1972    Mark I NEXTERA ENERGY (NEE.N) Duane Arnold       Cedar Rapids, IA       580        1975    Mark I SOUTHERN (SO.N) Hatch 1            Baxley, GA             876        1975    Mark I Hatch 2            Baxley, GA             883        1979    Mark I DTE ENERGY (DTE.N) Fermi 2            Monroe, MI            1122        1988    Mark I PSEG (PEG.N) Hope Creek         Hancock’s Brdg, NJ    1161        1986    Mark I ENTERGY (ETR.N) Fitzpatrick        Oswego, NY             854        1976    Mark I Pilgrim            Plymouth, MA           685        1972    Mark I Vermont Yankee     Vernon, VT             620        1972    Mark I XCEL XEL.N Monticello         Monticello, MN         572        1971    Mark I CONSTELLATION CEG.N Nine Mile Point 1  Oswego, NY             621        1969    Mark I Nine Mile Point 2  Oswego, NY            1140        1987    Mark II PPL (PPL.N) Susquehanna 1      Salem, PA             1149        1982    Mark II Susquehanna 2      Salem, PA             1140        1984    Mark II  (Reporting by Eileen O’Grady in Houston, Roberta Rampton in Washington and Scott DiSavino in New York; Editing by Lisa Shumaker)      ",7132011,http://www.reuters.com/article/usa-nuclear-reactors/rpt-factbox-u-s-nuclear-reactors-similar-to-fukushima-idUSN1E76C13920110713
