28,SO,Groups step up call for NRC delay after Fukushima,"HOUSTON/NEW YORK (Reuters) - About two dozen environmental groups launched a volley of legal challenges at nuclear regulators on Thursday in an attempt to stall action to extend the operation of aging reactors and to delay construction of more advanced nuclear designs.  Using findings of the U.S. Nuclear Regulatory Commission’s own Fukushima task force as ammunition, the groups, representing anti-nuclear parties from coast to coast, made filings with the NRC claiming that existing federal law requires the agency to address safety concerns in the Fukushima review before moving forward.  “The NRC may not issue or renew a single reactor license until it has either strengthened regulations to protect the public from severe accident risks or until it has made a careful and detailed study of the environmental implications of not doing so,” the groups said in a statement, citing provisions of the National Environmental Policy Act and the Atomic Energy Act.  NRC spokesman Scott Burnell said the agency will review the filings. “There is a well established process within the NRC for individuals or groups to raise legal challenges to NRC licensing activities,” Burnell said.  The latest filings echo arguments already raised by some of the regional environmental groups in the wake of the meltdown and release of radioactivity following the earthquake and tsunami that shattered Japan’s Fukushima Daiichi nuclear plant in March.  The NRC commission has yet to respond to that petition asking the agency to suspend all new reactor and license renewal activity, Burnell said, and there is no timetable for commission action.  “So this is not the first time that people have suggested the events at Fukushima should in their view cause the agency to stop doing everything,” Burnell said.  To bolster their effort, the group’s latest strategy is to rely on findings released last month by the NRC’s Fukushima task force, said Jim Warren of NC Warn, a North Carolina group challenging new reactors proposed by Duke Energy and Progress Energy.  “The NRC’s own ‘A-Team’ of experts warns that severe accidents must be considered in the U.S.,” Warren said. “Federal law does not allow the NRC commissioners to ignore those warnings in order to accommodate the nuclear industry.”  Burnell countered that the task force report “states in no uncertain terms that current reactors are safe and appropriate to continue operating.”  The report recommended an overhaul of the way regulators require the nation’s 104 reactors to prepare for disasters like earthquakes and floods, but NRC commissioners have disagreed on how quickly the agency should move ahead on the recommendations.  On Wednesday, NRC Chairman Gregory Jaczko chided current commissioners for their “reoccupation with process at the expense of nuclear safety policy.”  “What we’ve learned in the wake of Japan’s nuclear disaster — and what the NRC’s experts concluded — is that current regulations are fundamentally inadequate,” said Phillip Musegaas, Hudson Program Director of Riverkeeper Inc, which filed a challenge related to Entergy Corp’s Indian Point nuclear reactor in New York.  So far, the Fukushima disaster has not altered the NRC’s timeline to relicense older nuclear plants or to evaluate new reactor designs.  Since the March 11 earthquake, the NRC has relicensed nine older reactors, extending the operation of each by 20 years, and this week moved forward to certify the Westinghouse AP1000 nuclear design which developers plan to use to build the nation’s first new reactors in 30 years.  Any Fukushima-related changes deemed necessary to improve safety will be applied to all nuclear reactors, new or old, the NRC has said repeatedly.  Thursday’s filings seek to force the NRC to address safety concerns raised by Fukushima before deciding on all active requests for reactor relicensing, such as Indian Point and First Energy’s Davis-Besse reactor in Ohio, as well as the NRC’s AP1000 design certification process and applications for new reactor licenses, such as Southern Co’s Vogtle nuclear expansion in Georgia and SCANA Corp’s Summer plant expansion in South Carolina.  Other nuclear plants that were the target of the 19 filings are operated by Constellation Energy Group, Dominion Resources, DTE Energy, PG&E Corp, NRG Energy, Energy Future Holdings, Duke Energy, PPL Corp, Progress Energy, NextEra Energy and the Tennessee Valley Authority.  ",8112011,http://www.reuters.com/article/us-utilities-nuclear/groups-step-up-call-for-nrc-delay-after-fukushima-idUSTRE77A2N720110811
29,SO,New Issue-The Southern Company sells $500 mln in 5-yr snr notes,"  Aug 16 (Reuters) - The Southern Company (SO.N) on Tuesday sold $500 million of senior notes, said IFR, a Thomson Reuters service.   Bank of America, Citi, US Bancorp and Wells Fargo were the joint bookrunning managers for the sale. BORROWER: SOUTHERN COMPANY AMT $500 MLN      COUPON 1.95 PCT     MATURITY 9/1/2016   TYPE SR NTS       ISS PRICE 99.848    FIRST PAY 3/1/2012  MOODY’S Baa1      YIELD 1.982 PCT     SETTLEMENT 8/23/2011 S&P A-MINUS       SPREAD 105 BPS      PAY FREQ SEMI-ANNUAL FITCH SINGLE-A     MORE THAN TREAS    MAKE-WHOLE CALL 15 BPS  ",8162011,http://www.reuters.com/article/southerncompany-debt-notes/new-issue-the-southern-company-sells-500-mln-in-5-yr-snr-notes-idUSN1E77F1FB20110816
30,SO,UPDATE 1-Southern's Vogtle 1 reactor in Georgia shut," (Adds company comments)  Aug 31 (Reuters) - Southern Co’s (SO.N) 1,150-megawatt Unit 1 at the Vogtle nuclear plant in the U.S. state of Georgia automatically shut down on Wednesday morning during maintenance on a valve that controls water flow to a steam generator.  “There was increased airflow in the valve and the valve opened, increasing the water level condition in the steam generator,” company spokeswoman Amoi Geter said.  The unit was safe and stable as plant safety systems operated as designed, the company said in a statement.  There was no risk to the public, it said.  Unit 2 was operating at 97 percent power in preparation for a routine, scheduled refueling outage. —————————————————————————————- PLANT BACKGROUND/TIMELINE STATE:     Georgia COUNTY:    Burke County TOWN:      Near Augusta, Georgia OPERATOR:  Southern Nuclear Operating Co OWNER(S):  Southern Nuclear Operating Co CAPACITY:  2,302 MW, one of 100 largest power plants in U.S. UNIT(S):   1 - 1,150 MW Westinghouse four-loop pressurized         water reactor         2 - 1,152 MW Westinghouse four-loop pressurized         water reactor FUEL:      Nuclear DISPATCH:  Baseload COST:      $19.071 bln (2007 USD) TIMELINE: 1987 -     Unit 1 enters commercial service 1989 -     Unit 2 enters commercial service 2008 -     Co submitted application for two new PWR reactors         at site. The units would be Westinghouse Advanced         Passive 1000 (AP1000) reactors. 2009 -     NRC approves license renewal for Units 1 & 2 2047 -     Unit 1 license to expire unless renewed 2049 -     Unit 2 license to expire unless renewed (Reporting by Koustav Samanta in Bangalore; Editing by Dale Hudson)       ",8312011,http://www.reuters.com/article/utilities-operations-southern-vogtle/update-1-southerns-vogtle-1-reactor-in-georgia-shut-idUSN1E77U1ON20110831
31,SO,House passes bill to block EPA clean air rules,"WASHINGTON (Reuters) - The House of Representatives passed a bill on Friday to block regulations that force industry to reduce unhealthy air emissions, such as mercury from coal-fired power plants, but the White House has promised to veto the measure and keep new clean air rules in place.  The vote was 249 to 169, largely along party lines.  Lawmakers in the Republican-controlled House have targeted Environmental Protection Agency air rules, saying they would kill jobs and burden businesses with billions of dollars in additional costs at the worst possible time.  “The Obama Administration is moving too fast and showing little regard for the economic consequences of their energy and environmental policies,” said Representative John Sullivan, who sponsored the bill.  The Transparency in Regulatory Analysis of Impacts on the Nation, or TRAIN, Act was also supported by less than 20 Democrats, most of them from coal and other energy-producing states.  The bill would also likely delay the EPA rule introduced in July that would cut smog and soot from coal-fired plants. That rule, the Cross State Air Pollution Rule, would add costs to power generators such as Southern Co, and American Electric Power, and would force coal-fired power plants in 27 states east of the Rocky Mountains to slash the amount of pollution they give off. The rule is slated to take effect in January.  The TRAIN Act, which must be passed in the Democratic-controlled Senate and signed by Obama to become law, would set up an interagency panel led by the Commerce Department to assess the impact of EPA rules on the economy.  Democrats in the Senate have promised to quash the bill. Even if they do, parts of the measure could reappear later in the year as part of a broad spending bill that Democrats would find hard to vote against.  With an eye to next year’s elections, Republicans will likely tout the House’s passage of the bill as evidence they tried to save American energy jobs.  Deliberations in the EPA review panel the bill sets up would delay several agency rules including regulations on mercury emissions slated to be laid out in November. The heavy metal accumulates in fish that can lead to neurological problems in people who consume them.  Environmentalists criticized TRAIN’s passage in the House, saying it would change the process for setting national air standards and lead to premature deaths from heart and lung illnesses.  “Sacrificing tens of thousands of American lives will not create more jobs,” said Michael Brune, the executive director of the Sierra Club. “Burdening the American people with billions of dollars in health bills will not lead to economic growth.”  ",9232011,http://www.reuters.com/article/us-usa-house-pollution/house-passes-bill-to-block-epa-clean-air-rules-idUSTRE78M5KD20110923
32,SO,UPDATE 1-US House passes bill to block EPA clean air rules," * Bill would set up panel to assess impact of EPA rules  * White House threatens Obama would veto  * Would delay finalized Cross State Air Pollution Rule  (Adds details on EPA rules, the bill’s chances in Senate)  By Timothy Gardner  WASHINGTON, Sept 23 (Reuters) - The U.S. House of Representatives passed a bill on Friday to block regulations that force industry to reduce unhealthy air emissions, such as mercury from coal-fired power plants, but the White House has promised to veto the measure and keep new clean air rules in place.  The vote was 249 to 169, largely along party lines.  Lawmakers in the Republican-controlled House have targeted Environmental Protection Agency air rules, saying they would kill jobs and burden businesses with billions of dollars in additional costs at the worst possible time.  “The Obama Administration is moving too fast and showing little regard for the economic consequences of their energy and environmental policies,” said Representative John Sullivan, who sponsored the bill.  The Transparency in Regulatory Analysis of Impacts on the Nation, or TRAIN, Act was also supported by less than 20 Democrats, most of them from coal and other energy-producing states.  The bill would also likely delay the EPA rule introduced in July that would cut smog and soot from coal-fired plants. That rule, the Cross State Air Pollution Rule, would add costs to power generators such as Southern Co (SO.N), and American Electric Power (AEP.N), and would force coal-fired power plants in 27 states east of the Rocky Mountains to slash the amount of pollution they give off. The rule is slated to take effect in January.  The TRAIN Act, which must be passed in the Democratic-controlled Senate and signed by Obama to become law, would set up an interagency panel led by the Commerce Department to assess the impact of EPA rules on the economy.  Democrats in the Senate have promised to quash the bill. Even if they do, parts of the measure could reappear later in the year as part of a broad spending bill that Democrats would find hard to vote against.  With an eye to next year’s elections, Republicans will likely tout the House’s passage of the bill as evidence they tried to save American energy jobs.  <^^^^^^^^^^^^^^^^^^^^^^^^^^^^^^^^^^^^^^^^^^^^^^^^^^^^^^^^^  US aims to cut smog, soot from coal      [ID:nN1E7660XM]  ANALYSIS-Republicans turn sights on EPA  [ID:nN1E77320P]  US accepts Bush-era smog bill it bashed  [ID:nS1E78L1AJ]  FACTBOX-US coal units to retire on EPA   [ID:nS1E78J1D9]    ^^^^^^^^^^^^^^^^^^^^^^^^^^^^^^^^^^^^^^^^^^^^^^^^^^^^^^^^^>  HEALTH BILLS  Deliberations in the EPA review panel the bill sets up would delay several agency rules including regulations on mercury emissions slated to be laid out in November. The heavy metal accumulates in fish that can lead to neurological problems in people who consume them.  Environmentalists criticized TRAIN’s passage in the House, saying it would change the process for setting national air standards and lead to premature deaths from heart and lung illnesses.  “Sacrificing tens of thousands of American lives will not create more jobs,” said Michael Brune, the executive director of the Sierra Club. “Burdening the American people with billions of dollars in health bills will not lead to economic growth.”  (Editing by Andrea Evans)   ",9232011,http://www.reuters.com/article/usa-house-pollution/update-1-us-house-passes-bill-to-block-epa-clean-air-rules-idUSS1E78M1HT20110923
33,SO,GE calls for shut-down tests on reactors worldwide," * GE says problem could occur under limited conditions   * NRC says problem not an “immediate” safety issue   * Boiling-water design similar to GE reactors at Fukushima   By Jim Brumm   WILMINGTON, NC Sept 30 (Reuters) - GE Hitachi Nuclear Energy has warned operators of boiling water reactors (BWR) worldwide — including 35 in the U.S. — that the plants could fail to shut automatically during an earthquake, potentially risking the safety of the power plant.   In an event notification posted by the Nuclear Regulatory Commission this week, GE Hitachi told nuclear operators to conduct tests to determine what conditions would prevent the reactors from shutting safely during an earth quake.   GE Hitachi Nuclear Energy is a venture between General Electric Co (GE.N) and Hitachi Limited (6501.T).   GE Hitachi spokesman Michael Tetuan said most nuclear plants could fix the problem by replacing fuel channels, if needed. A typical boiling water reactor has between 400 and 800 such channels.   The affected plants are of the same GE design as Japan’s Fukushima reactors which were crippled by an earthquake and tsunami in March.   GE said the probability of a reactor not shutting properly is very low. Because of the limited circumstances under which a unit might not shut automatically, NRC spokesman Scott Burnell said the issue “is not an immediate safety issue.”   He said GE’s notice is information the agency wants nuclear vendors to raise so that companies can respond.   Affected by the potential glitch are type 2-5 BWRs designed by General Electric and built between the late 1960s and the early 1990s.   In the U.S., 12 of those nuclear units are owned by Exelon Corp (EXC.N); five by Entergy Corp (ETR.N); and three by the Tennessee Valley Authority.   Other affected plants are owned by Constellation Energy Group CEG.N, Progress Energy PGN.N, Southern Co (SO.N), NextEra Energy (NEE.N), DTE Energy (DTE.N), Public Service Enterprise Group (PEG.N), PPL Inc (PPL.N), Xcel Energy XEL.N, Energy Northwest and the Nebraska Public Power District.   GE Hitachi identified the problem in July 2010 and reported to the NRC last September, months before an earthquake-spawned tsunami crippled GE reactors in Japan.   U.S. reactors included are Nine Mile Point Units 1 and 2; Fermi 2; Columbia; FitzPatrick; Pilgrim; Vermont Yankee; Grand Gulf; River Bend; Clinton; Oyster Creek; Dresden 2 and 3; LaSalle 1 and 2; Limerick 1 and 2; Peach Bottom 2 and 3; Quad Cities 1 and 2; Perry; Duane Arnold; Cooper; Monticello; Brunswick 1 and 2; Hope Creek; Hatch 1 and 2; and Browns Ferry 1, 2 and 3.   “We’ve proactively identified a very unique set of conditions in which a plant rarely operates where this is a concern,” Tetuan said. “With the guidance provided to our customers, they will be able to monitor potentially affected fuel channels and avoid a safety concern.”   Tetuan said the company also notified operators of BWRs located elsewhere.   The World Nuclear Association (WNA) website lists 53 BWRs outside the U.S., including 29 operating in Taiwan, Sweden, the Netherlands, Mexico, Japan, Italy, Germany and Finland.   The seven operating Japanese BWRs include Fukushima Daiichi 5 and 6 which were shut when the March earthquake hit.   GE Hitachi told the NRC the problem does not affect BWR/6 or ABWR - advanced boiling water reactor plants.   (Additional reporting by Eileen O’Grady in Houston; Editing by Bob Burgdorfer)       ",9302011,http://www.reuters.com/article/nuclear-us-ge/ge-calls-for-shut-down-tests-on-reactors-worldwide-idUSS1E78T1UO20110930
34,SO,New Issue-Mississippi Power sells $300 mln in 2 parts,,10112011,http://www.reuters.com/article/mississippipower-debt-notes/new-issue-mississippi-power-sells-300-mln-in-2-parts-idUSN1E79A1EW20111011
35,SO,UPDATE 2-Bombardier wins $296 mln British trains deal,"* Bombardier to supply 130 Electrostar carriages to Southern * Production to start in late 2012 * New carriages to enter service in December 2013 By Rhys Jones LONDON, Dec 28 (Reuters) - Bombardier, Britain’s last remaining train builder, has been awarded a 189-million-pound ($296 million) contract to supply 130 carriages to UK rail operator Southern. The deal should help ease the pain caused by Britain’s decision earlier this year to award a key rail contract to Germany’s Siemens AG, leading incumbent Bombardier to cut hundreds of jobs at its plant in Derby, central England. Canadian-owned Bombardier, whose British unit makes trains for use on the country’s railways, will build 130 of its new Electrostar rail carriages for Southern, which runs services in south London, Surrey, Sussex and Kent, Britain’s Department for Transport (DfT) said on Wednesday. “This deal for more than 100 new carriages is great news for rail passengers and brilliant news for Bombardier and Derby,” transport secretary Justine Greening said in a statement. “It lands Bombardier with a crucial train order and I look forward to Bombardier workers in Derby being among the winners of this important deal.” The DfT is providing 80 million pounds towards the new deal, which will see new carriages enter service in December 2013. “This is a significant project which emphasises the performance of Bombardier’s products in the UK,” said Paul Roberts, President of Bombardier Transportation, Services UK. “The new trains will be manufactured in the UK with initial production commencing in the latter half of 2012.” The DfT in June awarded a consortium led by Siemens a 1.4-billion-pound contract to build and maintain 1,200 carriages for the Thameslink cross-London railway. Earlier this month a committee of lawmakers said the process by which Britain reached that decision would be subject to an official review. Bombardier shares in Toronto, which have lost a fifth of their value in 2011, closed at 3.86 Canadian dollars on Dec. 23, their most recent day of trading, valuing the group at around 6.8 billion Canadian dollars. ",12282011,http://www.reuters.com/article/bombardier/update-2-bombardier-wins-296-mln-british-trains-deal-idUSL6E7NS0Z220111228
