51,SO,UPDATE 1-Mississippi allows Southern Co to keep building $2.8 bln coal plant,"* Utility says delay could cost $250 mln-$500 mln * Sierra Club appeals commission order late Friday * Dissenting commissioner says action contrary to state law By Eileen O’Grady March 30 (Reuters) - Mississippi utility regulators on Friday voted to allow a unit of Southern Co to continue building an $2.8 billion coal-gasification power plant in the state despite a court ruling that overturned the existing certificate issued two years ago. With only two days meeting notice and no discussion, the Mississippi Public Service Commission (PSC) voted 2-1 to issue a temporary certificate so that Southern Co’s smallest utility, Mississippi Power, can keep building the 582-megawatt integrated gasification combined-cycle (IGCC) power plant in Kemper County, according to the commission order. The Sierra Club, which successfully challenged the Kemper IGCC project, immediately filed an appeal at the Mississippi Supreme Court to block the certificate. The PSC order, supported by commissioner chairman Leonard Bentz and commissioner Lynn Posey, stated that the halting the project would lead to “unnecessary costs” that would cause substantial injury to the utility and its customers. According to a state filing, Mississippi Power said interrupting construction at the Kemper site could cost between $250 million and $500 million. “Any delays to this project would mean significant costs to our customers,” said Jeff Shepard, Mississippi Power spokesman in a release. “Today’s ruling means we can continue building a sound energy future for our customers.” The Kemper certificate, issued by the PSC in May 2010, was thrown into doubt earlier this month when the Mississippi Supreme Court ruled 9-0 that the commission failed to show evidence that the plant would benefit the utility’s customers as required by state law. The court sent the case back to the PSC. Commissioner Brandon Presley who has consistently opposed the Kemper project for its high price tag and untried technology called Friday’s action to issue a temporary certificate “squarely contrary to state law.” In his dissent, Presley said the order “totally misinterprets” the state statute “to Mississippi Power’s advantage and to the detriment of MPC’s customers.” “There is no way allowing construction to continue at Kemper is a temporary act,” Presley told Reuters. “Nobody with any sense would argue that. It’s not what the law says.” Bentz who represents most Mississippi Power customers in the southeast corner of the state, declined to comment through a spokeswoman while Posey, who represents Kemper County in central Mississippi, could not be reached late Friday. “It’s an absolute bailout of Mississippi Power,” said Louie Miller, director of the Sierra Club in Mississippi. In its appeal filed after Friday’s meeting, the Sierra Club asked the Supreme Court to rule that “Mississippi Power is not exempt from the law, and the Public Service Commission does not have the authority to bypass state law, according to a statement. Miller suggested that Mississippi Power customers would be better served if Mississippi Power converted the plant to run natural gas rather than lignite as gas prices have fallen dramatically since Kemper County was proposed several years ago. According to state filings, Mississippi Power has spent more than $1.1 billion on the Kemper County IGCC plant and has committed to contracts valued at $1.5 billion. It is expected to begin producing power in 2014. The utility has less than 200,000 customers. Kemper opponents, including independent power producers, said Mississippi Power could only justify customer savings by using a natural gas scenario that projected gas prices would rise from $11 per million British thermal units in 2014 to $22 per mmBtu in 2050. U.S. gas prices are the lowest in a decade due to booming output from shale-rock formations. IGCC technology heats coal to convert it into a synthesis gas that is processed to remove numerous pollutants before being sent to a traditional combined-cycle power plant to produce electricity. Kemper was designed to showcase a gasification technology developed by another Southern Co subsidiary to burn Mississippi lignite and had support from state economic development groups and then-Governor Haley Barbour.",3302012,http://www.reuters.com/article/utilities-southern-kemper/update-1-mississippi-allows-southern-co-to-keep-building-2-8-bln-coal-plant-idUSL2E8EUAHQ20120330
52,SO,Mississippi allows Southern Co to continue building coal plant,,3302012,http://www.reuters.com/article/idUSL2E8ETCUG20120330
53,SO,UPDATE 2-State re-issues certificate for Southern's Kemper coal plant,"* Southern’s Mississippi unit building costly gasification plant * Original certificate vacated by state supreme court * New certificate imposes “hard” cost cap of $2.88 billion By Eileen O’Grady April 24 (Reuters) - Mississippi utility regulators on Tuesday re-issued a certificate vacated last month by the state supreme court to keep construction of Southern Co’s $2.88 billion coal-gasification power plant in Kemper County moving forward. Without comment, the Mississippi Public Service Commission (PSC) voted 2-1 for the certificate so that Southern Co’s smallest utility, Mississippi Power, could build the 582-megawatt integrated gasification combined-cycle (IGCC) power plant in Kemper County, according to a webcast of the meeting. “We are pleased the process is moving forward,” said Mississippi Power spokesman Jeff Shepard in an email. The Sierra Club challenged the Kemper IGCC project in court, questioning its high cost and requested that the commission reopen the case in light of the dramatic drop in natural gas prices since the initial certificate was issued nearly two years ago. Sierra Club officials called the PSC action “yet another bailout at the expense of the ratepayer.” Tuesday’s revised PSC order was supported by PSC Chairman Leonard Bentz and Commissioner Lynn Posey and opposed by Commissioner Brandon Presley, who filed a dissenting opinion. The two commissioners who voted for the project “refused again to listen to the public or even consider the hard facts on Kemper,” said Louie Miller, state Sierra Club director, in a statement. The 133-page revised order keeps a soft cost cap of $2.4 billion on the Kemper project and a “hard cap” of $2.88 billion, said commission counsel Shawn Shurden. No cost can be recovered above $2.8 billion, “prudent or not,” Shurden told the commission. That figure however does not include costs to build the adjacent lignite mine or the pipeline to carry carbon dioxide produced by the plant. The commission said it was aware of changing gas prices and did not need to reopen the record on Kemper because the commission has an independent monitor overseeing construction. “By this order, we make explicit what was implicit in our previous orders: the Kemper County IGCC Project, given its low, stable fuel prices, its overall economics, and its significant contribution to preserving a reasonable level of fuel diversity for (Mississippi Power’s) generation portfolio satisfies the commission’s preference for a long-term baseload resource that will provide reliable service to (the utility’s) customers for the next 40 years,” the order states. In a 9-0 ruling, the Mississippi Supreme Court vacated the Kemper certificate issued by the PSC in mid-2010 saying the commission failed to show evidence that the plant would benefit the utility’s customers as required by state law. The court sent the case back to the PSC which issued a “temporary” certificate March 30. The commission’s lone dissenter, Presley said reopening the case to consider gas prices, cost overruns, environmental risk, the gasification technology and other topics would have been appropriate given the Supreme Court’s action. “Many of these issues cannot be addressed by the commission’s independent monitoring processes alone,” Presley wrote. “Supplementing the record with additional testimony and evidence is consistent with the court’s order and is an appropriate response to the court’s reversal and remand.” According to state filings, Mississippi Power has so far spent more than $1 billion on the Kemper County IGCC plant and another $109 million on the related lignite mine. Kemper is expected to begin producing power in 2014. Mississippi Power has less than 200,000 customers and the rate impact of the Kemper plant on customer bills has not been disclosed. Mississippi Power’s parent, Atlanta-based Southern Co, has 4.4 million customers in four states. Southern is scheduled to release its first-quarter earnings on Wednesday. IGCC technology heats coal to convert it into a synthesis gas that is processed to remove numerous pollutants before being sent to a traditional combined-cycle power plant to produce electricity. Kemper was designed to showcase a gasification technology developed by another Southern Co subsidiary to burn Mississippi lignite and had support from state economic development groups and then-Governor Haley Barbour.",4242012,http://www.reuters.com/article/utilities-southern-kemper/update-2-state-re-issues-certificate-for-southerns-kemper-coal-plant-idUSL2E8FOEBH20120424
54,SO,Mississippi re-issues certificate for Southern's coal plant,"April 24 (Reuters) - Mississippi utility regulators on Tuesday re-issued a certificate vacated last month by the state supreme court to keep construction of Southern Co’s $2.8 billion coal-gasification power plant in Kemper County moving forward. Without comment, the Mississippi Public Service Commission (PSC) voted 2-1 for the certificate so that Southern Co’s smallest utility, Mississippi Power, can build the 582-megawatt integrated gasification combined-cycle (IGCC) power plant in Kemper County, according to a webcast of the meeting. The Sierra Club challenged the costly Kemper IGCC project in court and requested that the commission reopen the case in light of the dramatic fall in natural gas prices since the initial certificate was issued. The Sierra Club did not immediately comment on Tuesday. Tuesday’s revised PSC order was supported by PSC Chairman Leonard Bentz and commissioner Lynn Posey and opposed by commissioner Brandon Presley who filed a dissenting opinion. The 133-page revised order keeps a soft cost cap of $2.4 billion on the Kemper project and a “hard cap” of $2.8 billion, said commission counsel Shawn Shurden. No cost can be recovered above $2.8 billion, “prudent or not,” Shurden told the commission. Those costs however, do not include costs to build the adjacent lignite mine or the pipeline to carry carbon dioxide produced by the plant. “The commission finds that a 20 percent cost cap above the commission-approved capital cost estimate constitutes a reasonable protection for customers against construction cost increases, while allowing for reasonable deviations from the original cost estimate so as not to unduly punish the company,” the PSC said in its order. Mississippi Power Jeff Shepard said the utility was pleased with the order. “We are pleased the process is moving forward,” Shepard said in an email. Shurden said the commission declined to reopen the case, citing the earlier record and the commission’s “preference” for lignite fuel which it believed would have more price certainty than natural gas over the 40-year life of the power plant. The Kemper certificate, issued by the PSC in May 2010, was vacated last month by the Mississippi Supreme Court which ruled 9-0 that the commission failed to show evidence that the plant would benefit the utility’s customers as required by state law. The court sent the case back to the PSC which issued a “temporary” certificate March 30 According to state filings, Mississippi Power has so far spent more than $1 billion on the Kemper County IGCC plant and another $109 million on the related lignite mine. Kemper is expected to begin producing power in 2014. Mississippi Power has less than 200,000 customers. Its parent, Atlanta-based Southern Co, has three other utilities in Georgia, Alabama and Florida, with a total of 4.4 million customers. Southern Co is scheduled to release its first-quarter earnings on Wednesday. IGCC technology heats coal to convert it into a synthesis gas that is processed to remove numerous pollutants before being sent to a traditional combined-cycle power plant to produce electricity. Kemper was designed to showcase a gasification technology developed by another Southern Co subsidiary to burn Mississippi lignite and had support from state economic development groups and then-Governor Haley Barbour.",4242012,http://www.reuters.com/article/utilities-southern-kemper/mississippi-re-issues-certificate-for-southerns-coal-plant-idUSL2E8FOB6J20120424
55,SO,"Southern boosts natgas use 40 pct, coal down 20 pct","HOUSTON, April 25 (Reuters) - Southern Co utilities will burn 40 percent more natural gas this year than last to take advantage of the lowest gas prices in a decade, and pare coal use by 20 percent, executives said on Wednesday. Southern Co Chief Executive Tom Fanning said the company’s four utilities are projected to burn more than 600 billion cubic feet of gas this year, up from 430 bcf last year and nearly three times the amount used in 2007 when Southern’s coal use was at its peak. “Southern’s gas purchases now account for more than 2 percent of all U.S. gas consumption, making us the third-largest user of natural gas among U.S. utilities,” Fanning said on a call with analysts. Coal burned this year will fall to about 45 million tons at Southern utilities, Fanning said, down from 56 million tons last year and the nearly 80 million tons burned in 2007. Overall, gas is projected to account for 47 percent of Southern’s fuel mix in 2012, while coal’s share will likely slip to 35 percent and nuclear generation will hold steady at 18 percent, Fanning said. That compares with a 16 percent share for gas in 2007 and a 70 percent share for coal, he said. If gas prices remain low, Fanning said, the fuel could grow to 57 percent of Southern’s fuel mix. Southern has about 43,000 megawatts of generation across the Southeast. The first of three new gas-fired units at Plant McDonough-Atkinson, rated at 840 MW, came online late last year, and two more units will begin commercial operation in April and November, Fanning said. As the utilities reduce coal use, they will remain flexible should gas prices rise, Fanning said. The companies are working to match coal purchases to utility need, to maximize onsite and offsite coal storage, defer purchases and renegotiate coal and rail contracts when possible. Fanning said cost and schedule targets “remain achievable” for the company’s two major construction projects — the $14 billion nuclear units at Plant Vogtle in Georgia and a $2.8 billion advanced-coal plant in Mississippi. He said the Department of Energy has recently proposed new conditions for the $8.3 billion loan guarantee granted to the partners building Vogtle on a conditional basis two years ago. “We still remain hopeful we’ll have loan guarantees, but as a matter of course since Solyndra the DOE has proposed some new conditions that really relate to project finance conditions rather than corporate credit,” Fanning said. “We are working through those issues and hope we will reach a successful conclusion.” Should the agency “ask us to do something that is not in the customers’ interest, we won’t go forward,” Fanning added. Mississippi regulators on Tuesday reissued a certificate to allow construction to continue at the integrated gasification combined-cycle power plant in Kemper County. Southern reported first-quarter earnings of $368 million, or 42 cents per share, down from $422 million, or 50 cents a share, in the year-earlier quarter, due to a warmer-than-normal winter. Revenue fell 10 percent to $3.6 billion from $4.01 billion as power sales fell 5 percent, according to the company. ",4252012,http://www.reuters.com/article/utilities-southern-coal/southern-boosts-natgas-use-40-pct-coal-down-20-pct-idUSL2E8FPK0320120425
56,SO,"Southern, Duke push US coal gasification; others quit","* Gasification seen preserving coal as electric fuel * Technology challenged by costly construction, cheap gas * Duke IGCC project to raise Indiana rates 14 percent By Eileen O’Grady HOUSTON, June 12 (Reuters) - Only two U.S. electric utilities are building expensive coal-gasification power plants, while dozens of similar facilities have been scrapped and some remaining projects may eliminate coal in favor of abundant, cheap natural gas. Duke Energy’s 618-megawatt Edwardsport coal project in Indiana and Southern Co’s 582-MW Kemper County project in Mississippi are the only “integrated gasification combined cycle”, or IGCC plants, under construction out of more than three dozen proposed in the United States over the last decade. Of the handful of other IGCC projects still in development, two are looking at switching to gas as the primary fuel and dropping coal — at least for now. The power industry cited gasification technology as a way to save coal’s role as the dominant fuel in electric generation as federal limits on carbon dioxide (CO2) emissions appeared imminent, but the technology was unable to gain traction in the face of high capital costs, carbon legislation delay and rising supplies of natural gas. IGCC plants face a “host of issues”, starting with high construction costs, said Gary Stiegel, director of major projects at the Energy Department’s National Energy Technology Laboratory, which supports clean-coal technology. With only two plants being built, Duke and Southern “need to show that they are able to start up and achieve their production capacity within a reasonable time,” Stiegel said. IGCC technology employs a chemical process that converts coal into a synthesis gas, using steam and pressure. The so-called “syngas” can be stripped of impurities, then burned in a gas turbine to produce electricity. IGCC also offers the ability to capture emissions — such as heat-trapping CO2 — for storage or other use. The Environmental Protection Agency in March proposed its first rules to reduce CO2 from future coal-fired plants by requiring them to capture and store emissions. “That will add additional expense to these projects,” Stiegel said. High construction costs and technical glitches dogged the nation’s first three IGCC projects in the 1990s. Only two still run: TECO Energy’s 250-megawatt Polk County IGCC in Florida and the 260-MW Wabash River Power Station in Indiana, operated by Duke. As prospects dimmed for carbon legislation, gas prices declined while shale production rose and recession eroded the need for new generation, many of the nearly 20,000 MW of proposed IGCCs were abandoned with little fanfare. American Electric Power, which once touted IGCC as a “critical” technology for the nation, is no longer pursuing an ambitious plan to build three IGCC plants in the Midwest. NRG Energy, Xcel Energy, ConocoPhillips  and a utility owned by Berkshire Hathaway’s  MidAmerican Energy Holdings Co have also dropped IGCC plans. Even TECO and Southern backed away from developing larger IGCC projects in Florida as coal fell out of favor there. In 2008, after a long site-selection process, FutureGen, the industry’s showcase IGCC plant featuring carbon capture and sequestration (CCS), lost Energy Department financial support due to soaring cost estimates. A revised FutureGen 2.0 project will not include coal gasification. Now, the lowest gas prices in a decade make it even harder for companies to justify IGCC’s costs for the ratepayers that must pay the tab. “One challenge to moving this type of project forward is capital costs,” Stiegel said. “Another big issue is getting financing. They are expensive and not many IGCCs have been built, so the financial markets are concerned.” Duke’s Edwardsport IGCC project is expected to produce power by year-end. Cost overruns have boosted its price tag to $3.3 billion from early estimates of less than $2 billion. Under a settlement proposed to satisfy consumer groups, Duke’s Indiana customers will pay just 79 percent of Edwardsport’s price tag. That will limit the rate increase on Duke’s 790,000 customers in Indiana to 14.5 percent, down from 22 percent without the settlement, the utility said. Construction at the IGCC project run by Southern’s Mississippi Power Co continues despite an ongoing legal challenge by the Sierra Club. After initially capping Kemper’s cost at $2.4 billion, a divided Mississippi Public Service Commission raised the amount that the utility can recover from its 190,000 customers to a maximum of $2.88 billion. In the most recent monthly update, Mississippi Power said it had spent or committed $1.5 billion to the Kemper project, which was running $366 million over the initial budget. Southern also disclosed a $1.7 million consulting contract with Anthony Topazi, the former Mississippi Power president whom Southern credits for obtaining state approval of Kemper. Topazi, 62, who was promoted to chief operating officer at the parent company two months after regulators initially approved Kemper, said he will retire on Aug. 1. Expected to be operational in 2014, the Kemper County IGCC plant will showcase technology developed by another Southern unit, along with KBR Inc and the DOE, called Transport Integrated Gasification, or TRIG, which can be used to gasify lower-quality coal such as the lignite in Mississippi. In 2009, Southern licensed the TRIG technology to a Chinese utility. KBR presentations say the technology has “huge potential” in China, India, Australia and Indonesia, countries with large supplies of lower-quality coal. Meanwhile, a handful of IGCC projects remain active, but some have decided to join the natural gas trend, rather than buck it. Calgary-based EmberClear will use gas, rather than coal, to fuel its 300-MW Good Spring plant in northeastern Pennsylvania, dropping the IGCC component for now. “Lack of regulatory clarity on emissions for coal-based electricity plants plus the immediate availability of natural gas provides a strong incentive to use natural gas as the primary fuel source,” EmberClear said in a release. “This modification lowers the project complexity, reduces the capital cost by at least 60 percent and accelerates the construction schedule.” Tenaska, which has been working to develop the Taylorville IGCC project in Illinois for several years, may build a gas-fired power plant and defer the gasification component, the Nebraska-based independent power producer said. “The concept would be to wait until a subsequent legislative approval after economic conditions for gasification improve,” said Bart Ford, Tenaska’s vice president for development. Other active IGCC projects include Summit Energy’s 400-MW Texas Clean Energy project, Hydrogen Energy California in Kern County and ERORA’s 770-MW Cash Creek IGCC in Kentucky.",6122012,http://www.reuters.com/article/utilities-coal-gasification/southern-duke-push-us-coal-gasification-others-quit-idUSL1E8H78P420120612
