75,SO,"Southern Co profit rises, weak economy hits energy sales","(Reuters) - Southern Co (SO.N), the No.2 U.S. power company by market value, reported a 6 percent rise in quarterly profit as reductions in non-fuel operations and maintenance expenses offset lower sales arising from mild weather and an uncertain economy. “After a promising first six months of 2012, the economy has slowed due to uncertainty around the elections, the fiscal cliff and the slowing world economy,” Chief Executive Thomas Fanning said in a statement. Total energy sales to the company’s customers in the Southeast, including wholesale sales, fell 4.9 percent in the third quarter. “We continue to believe that the long-term prospects for the Southeast remain strong relative to other portions of the country,” Fanning said, adding that the near-term outlook for the national economy was unclear. As power demand tends to reflect growth in a region, comments on the economy by Southern Co and bigger rival Duke Energy Corp (DUK.N) are keenly followed by investors. Southern Co, which supplies power in Alabama, Georgia, Florida, and Mississippi, has been immune to the devastation caused by superstorm Sandy, which has caused power outages along the U.S. East Coast. Earnings rose to $976 million, or $1.11 per share, in the third-quarter, from $916 million, or $1.07 per share, a year earlier. Operating revenues fell 7 percent to $5.05 billion. Shares of Southern Co, valued at about $40 billion, closed at $45.77 on the New York Stock Exchange on Friday. (Reporting by Swetha Gopinath in Bangalore; Editing by Supriya Kurane)",11052012,http://www.reuters.com/article/us-southernco-results/southern-co-profit-rises-weak-economy-hits-energy-sales-idUSBRE8A40MK20121105
76,SO,"Southern Co profit rises, weak economy hits energy sales","Nov 5 (Reuters) - Southern Co, the No.2 U.S. power company by market value, reported a 6 percent rise in quarterly profit as reductions in non-fuel operations and maintenance expenses offset lower sales arising from mild weather and an uncertain economy. “After a promising first six months of 2012, the economy has slowed due to uncertainty around the elections, the fiscal cliff and the slowing world economy,” Chief Executive Thomas Fanning said in a statement. Total energy sales to the company’s customers in the Southeast, including wholesale sales, fell 4.9 percent in the third quarter. “We continue to believe that the long-term prospects for the Southeast remain strong relative to other portions of the country,” Fanning said, adding that the near-term outlook for the national economy was unclear. As power demand tends to reflect growth in a region, comments on the economy by Southern Co and bigger rival Duke Energy Corp are keenly followed by investors. Southern Co, which supplies power in Alabama, Georgia, Florida, and Mississippi, has been immune to the devastation caused by superstorm Sandy, which has caused power outages along the U.S. East Coast. Earnings rose to $976 million, or $1.11 per share, in the third-quarter, from $916 million, or $1.07 per share, a year earlier. Operating revenues fell 7 percent to $5.05 billion. Shares of Southern Co, valued at about $40 billion, closed at $45.77 on the New York Stock Exchange on Friday.",11052012,http://www.reuters.com/article/southernco-results/southern-co-profit-rises-weak-economy-hits-energy-sales-idUSL3E8M54N620121105
77,SO,US Energy Dept extends talks with Southern Co on reactor loan,,12122012,http://www.reuters.com/article/utilities-nuclear-southern-vogtle/us-energy-dept-extends-talks-with-southern-co-on-reactor-loan-idUSL1E8NCH9H20121212
78,SO,American chef's independent spirit fires Southern cuisine,"NEW YORK (Reuters) - “Fire in my Belly” is an apt title for the debut cookbook of U.S. chef and restaurateur Kevin Gillespie, who turned down a scholarship to the prestigious Massachusetts Institute of Technology because a career in science just didn’t feel right. “I’ve always been incapable of pursuing something that I didn’t have a connection with, not so much cerebral as emotional,” explained Gillespie, whose passions led instead to culinary school and an apprenticeship at the Ritz-Carlton Hotel in Atlanta. Under chapters such as “Foods You Thought You Hated” and “Junk Food,” the 120 recipes in Gillespie’s book reflect his independent spirit as much as his former restaurant, the Woodfire Grill, and his Southern roots. Gillespie, who is from Atlanta and was recognized in 2010 by the Gayot guide as one of the top five rising U.S. chefs, spoke to Reuters about “progressive Southern cuisine,” non-elitist fine dining, and why a well-executed deep-fried candy bar can be really delicious. Q: How did you learn to cook? A: “Everyone learns from their family. I grew up in a traditional Southern family cooking traditional Southern cuisine. Simultaneously my maternal grandmother was well traveled and intrigued by food, so she would experiment with different types of cuisine ... Professionally, I worked almost exclusively under Europeans. Today, my food is a perfect blending of all these things.” Q: You sold your Woodfire Grill restaurant in Atlanta to open a new one, Gun Show, in February in the same city. Why? A: “I had an elitist restaurant. The Woodfire Grill restaurant, which I had for five years, was very formal fine dining. As I grew as a chef I became more interested in having a restaurant that people in all walks of life can be comfortable in. That’s not to say that we’ll abandon fine dining, but I wanted a more welcoming space. I think cooking has always attempted to bring people together, not separate them.” Q: How would you describe your cuisine? A: “My cuisine is reflective of the South, rooted in the South. I tend to prefer the term ‘progressive Southern’ to ‘modern Southern,’ which I think is oxymoronic. I’m not attempting to modernize anything. I’m attempting to move our history forward.” Q: Why does your book include a chapter called Junk Food? A: “There is a place in this world for all types of food. I don’t believe that by design one type of cooking is better. I think that by execution one tends to be better. I think that well-conceived and well-executed quote-unquote junk food can be really delicious. But it requires the same thought and passion as your five-star fine dining cuisine.” Q: Is that what led to re-engineer the deep-fried candy bar? A: “The deep-fried candy bar is rooted in Scottish tradition. The idea is cool but it’s poorly executed. No one really tried to make it great. They just made it ... Most people outside of chefs wouldn’t spend five minutes trying to make a fried candy bar perfect. It’s just junk food, so who cares? I care.” Q: What staples do you recommend to the home chef? A: “People leave salt out of their food all the time, maybe because processed food has salt embedded in it. When you deal with fresh food you have to come back to seasoning, to salt. Also neutral cooking oil, such as canola or grape seed, (but) not as a substitute for extra virgin olive oil. They have different uses. And good quality apple cider vinegar. For American cooking it’s indispensable.” Q: Do you have any advice for the home cook? A: “The only real time in the kitchen is how long things take to cook. It’s not when you’re ready to eat or when your (TV) show is coming on. If you try to find faster ways to do something you will end up with a lesser quality result.” My Granny’s Pole Beans (serves six) Pole beans 1 pound, strings and tips removed Onion 1 baseball-size, quartered Garlic 1 clove, mashed Smoked fatback 2 ounces, cut into 1-inch cubes Salt 1 teaspoon Dried red pepper flakes ½ teaspoon Bay leaf 1 Chicken stock about 4 cups Apple cider vinegar 2 teaspoons Cut the pole beans into 1-inch pieces and put them in a Dutch oven. Add the onion, garlic, fatback, salt, red pepper flakes, bay leaf, and enough chicken stock to generously cover the ingredients. Cover the pot and bring the beans to a boil. Cut the heat down and simmer, covered, until a knife goes straight through a bean with no resistance, about 30 minutes. The beans should be quite tender but not mushy. Turn off the heat and stir in the vinegar. Taste and add salt if needed. Uncover and let the beans cool to room temperature in their liquid. This is where Granny got it right: She’d start the beans early in the morning, set them aside, and let them finish cooking as they cooled down. It’s a slow-cooking method that most folks don’t think about today. But the extra time off the heat brings the flavors together like no other method can. Be sure to make this recipe at least two hours in advance so the beans have time to cool in the cooking liquid. Then just skim the fat from the surface and reheat the beans before serving. ",1082013,http://www.reuters.com/article/us-food-chefs-gillespie/american-chefs-independent-spirit-fires-southern-cuisine-idUSBRE90709O20130108
79,SO,American chef's independent spirit fires Southern cuisine,"NEW YORK, Jan 8 (Reuters) - “Fire in my Belly” is an apt title for the debut cookbook of U.S. chef and restaurateur Kevin Gillespie, who turned down a scholarship to the prestigious Massachusetts Institute of Technology because a career in science just didn’t feel right. “I’ve always been incapable of pursuing something that I didn’t have a connection with, not so much cerebral as emotional,” explained Gillespie, whose passions led instead to culinary school and an apprenticeship at the Ritz-Carlton Hotel in Atlanta. Under chapters such as “Foods You Thought You Hated” and “Junk Food,” the 120 recipes in Gillespie’s book reflect his independent spirit as much as his former restaurant, the Woodfire Grill, and his Southern roots. Gillespie, who is from Atlanta and was recognized in 2010 by the Gayot guide as one of the top five rising U.S. chefs, spoke to Reuters about “progressive Southern cuisine,” non-elitist fine dining, and why a well-executed deep-fried candy bar can be really delicious. Q: How did you learn to cook? A:  “Everyone learns from their family. I grew up in a traditional Southern family cooking traditional Southern cuisine. Simultaneously my maternal grandmother was well traveled and intrigued by food, so she would experiment with different types of cuisine ... Professionally, I worked almost exclusively under Europeans. Today, my food is a perfect blending of all these things.” Q: You sold your Woodfire Grill restaurant in Atlanta to open a new one, Gun Show, in February in the same city. Why? A: “I had an elitist restaurant. The Woodfire Grill restaurant, which I had for five years, was very formal fine dining. As I grew as a chef I became more interested in having a restaurant that people in all walks of life can be comfortable in. That’s not to say that we’ll abandon fine dining, but I wanted a more welcoming space. I think cooking has always attempted to bring people together, not separate them.” Q: How would you describe your cuisine? A: “My cuisine is reflective of the South, rooted in the South. I tend to prefer the term ‘progressive Southern’ to ‘modern Southern,’ which I think is oxymoronic. I’m not attempting to modernize anything. I’m attempting to move our history forward.” Q: Why does your book include a chapter called Junk Food? A: “There is a place in this world for all types of food. I don’t believe that by design one type of cooking is better. I think that by execution one tends to be better. I think that well-conceived and well-executed quote-unquote junk food can be really delicious. But it requires the same thought and passion as your five-star fine dining cuisine.” Q: Is that what led to re-engineer the deep-fried candy bar? A: “The deep-fried candy bar is rooted in Scottish tradition. The idea is cool but it’s poorly executed. No one really tried to make it great. They just made it ... Most people outside of chefs wouldn’t spend five minutes trying to make a fried candy bar perfect. It’s just junk food, so who cares? I care.” Q: What staples do you recommend to the home chef? A: “People leave salt out of their food all the time, maybe because processed food has salt embedded in it. When you deal with fresh food you have to come back to seasoning, to salt.  Also neutral cooking oil, such as canola or grape seed, (but) not as a substitute for extra virgin olive oil. They have different uses. And good quality apple cider vinegar. For American cooking it’s indispensable.” Q: Do you have any advice for the home cook? A:  “The only real time in the kitchen is how long things take to cook. It’s not when you’re ready to eat or when your (TV) show is coming on. If you try to find faster ways to do something you will end up with a lesser quality result.” My Granny’s Pole Beans (serves six) Pole beans 1 pound, strings and tips removed Onion 1 baseball-size, quartered Garlic 1 clove, mashed Smoked fatback 2 ounces, cut into 1-inch cubes Salt 1 teaspoon Dried red pepper flakes ½ teaspoon Bay leaf 1 Chicken stock about 4 cups Apple cider vinegar 2 teaspoons Cut the pole beans into 1-inch pieces and put them in a Dutch oven. Add the onion, garlic, fatback, salt, red pepper flakes, bay leaf, and enough chicken stock to generously cover the ingredients. Cover the pot and bring the beans to a boil. Cut the heat down and simmer, covered, until a knife goes straight through a bean with no resistance, about 30 minutes. The beans should be quite tender but not mushy. Turn off the heat and stir in the vinegar. Taste and add salt if needed. Uncover and let the beans cool to room temperature in their liquid. This is where Granny got it right: She’d start the beans early in the morning, set them aside, and let them finish cooking as they cooled down. It’s a slow-cooking method that most folks don’t think about today. But the extra time off the heat brings the flavors together like no other method can. Be sure to make this recipe at least two hours in advance so the beans have time to cool in the cooking liquid. Then just skim the fat from the surface and reheat the beans before serving.   (Editing by Patricia Reaney and Paul Simao)",1082013,http://www.reuters.com/article/food-chefs-gillespie/american-chefs-independent-spirit-fires-southern-cuisine-idUSL1E8N4ASV20130108
80,SO,UPDATE 2-Mississippi reconsiders Southern Co utility rate hike denial,"* Utility to refile request for higher rates tied to Kemper * Settlement calls for future royalty payments to customers By Eileen O’Grady Jan 24 (Reuters) - The Mississippi Public Service Commission on Thursday approved a settlement with Southern Co’s  Mississippi utility that will allow the company to seek higher rates for costs tied to a $3 billion coal-gasification power plant under construction in Kemper County. Mississippi Power Co is building a 582-megawatt, integrated gasification combined-cycle (IGCC) plant scheduled to begin operating in May 2014. Thursday’s settlement gives Mississippi Power Co another chance to request a rate hike of as much as $172 million this year and calls for the commission to act on the request within 50 days of the utility’s request. Last June, the commission denied the utility’s request for $55 million over six months, saying customer rates should not be raised until a legal challenge from an environmental group, the  Sierra Club, was resolved. The Mississippi Supreme Court also denied the utility’s motion to charge interim rates while the Kemper certificate was under appeal. Louie Miller, the Sierra Club’s state director, said the settlement offers no benefits to Mississippi Power customers and was approved only to help the utility which he said is struggling financially. “They (Mississippi Power) bit off way more than they can chew” with the costly Kemper project, said Miller. “Today’s reckless actions by the commission have opened the door for Mississippi Power to charge their customer base for the boondoggle Kemper County Coal Plant while it’s under construction, with no guarantee that the plant will ever produce a single megawatt of electricity,” Miller said. In the settlement, the commission acknowledged that uncertainty over the rate issue has hurt Mississippi Power’s credit rating. It also cited “a high likelihood” that the Kemper County certificate will withstand the ongoing court appeal. The commission voted 2-to-1 to approve the settlement at a special meeting called a day earlier. No details of the proposed settlement were discussed before the commission held an executive session which was closed to the public. The pact also sets up a framework to establish cost-recovery for the Kemper plant over the first seven years of its operation, if allowed by the state legislature. In return, Mississippi Power customers will receive a credit for 10 percent of any royalties Southern derives from future sale to other utilities of the gasification technology being used at Kemper. “The settlement today further puts into place the protections of the ratepayers by affirming the cost cap for the Kemper Project at $2.4 billion,” said PSC Chairman Leonard Bentz in a statement. Mississippi Power officials did not return calls for comment. The utility is Southern Co’s smallest with just 185,000 customers, so the rate impact of the costly Kemper facility is of concern to regulators and consumer groups in the state. Under the Mississippi Baseload Act, the utility planned to begin charging customers for certain costs related to Kemper while the plant was under construction, but its efforts were blocked by the state’s highest court. Thursday’s special meeting precedes scheduled oral arguments on Monday at the state supreme court related not only to Mississippi Power’s appeal of the rate denial but to the larger question of whether the state law under which Mississippi Power would raise customer rates during construction is constitutional. Michael Adelman, an attorney representing some of the utility’s customers in the appeal, said the oral arguments should go forward. “I’m going to be at the court at 1:30 Monday, unless told otherwise,” he said. “We believe there are serious constitutional problems with that statute.” Adelman said the settlement “kicks the can down the road in an attempt to create some aura that they have reached an agreement, but they have not reached any more of an agreement than in all the months we spent before the hearing last June when they denied any increase.” The settlement keeps intact the commission’s $2.4 billion approved cost for the plant plus contingency costs. Additional costs, including $240 million for a nearby mine to supply lignite to the plant and a $140 million pipeline to transport carbon dioxide emissions from the plant, will push the total Kemper price tag above $3 billion. ",1242013,http://www.reuters.com/article/utilities-southern-kemper/update-2-mississippi-reconsiders-southern-co-utility-rate-hike-denial-idUSL1N0ATC8N20130124
81,SO,Southern's Mississippi unit reaches settlement over Kemper rates,"Jan 24 (Reuters) - The Mississippi Public Service Commission on Thursday approved a settlement with Southern Co’s  Mississippi utility over ongoing litigation that has prevented the company from charging customers for costs tied to a $3 billion coal-gasification power plant under construction in Kemper County. Details of the settlement were not disclosed at a hastily called meeting of the Mississippi Public Service Commission, but will be released later on Thursday, PSC Chairman Leonard Bentz said. Discussion of the proposed settlement was held in executive session of the commission. Mississippi Power unit is building a 582-megawatt, integrated gasification combined-cycle (IGCC) plant scheduled to begin operating in May 2014. The utility is Southern’s smallest with just 185,000 customers so the rate impact of the costly plant is of concern to consumer groups in the state. Under the Mississippi Baseload Act, the utility planned to begin charging customers for certain costs related to Kemper while the plant was under construction, but its efforts have been blocked by the state’s highest court.",1242013,http://www.reuters.com/article/utilities-southern-kemper/southerns-mississippi-unit-reaches-settlement-over-kemper-rates-idUSL1N0ATBYS20130124
82,SO,Southern Co unit requests higher rates for Kemper coal plant,"* Settlement opens door for recovery above earlier cost cap * Rate request puts focus on Supreme Court hearing Jan 25 (Reuters) - Southern Co’s Mississippi Power unit filed a request late Friday to increase its rates by $172 million to begin collecting costs related to a $3 billion coal-gasification power plant under construction in Kemper County, Southern officials said. The rate filing with state regulators comes one day after the Mississippi Public Service Commission approved a settlement that opens the door for the utility to recover all rising costs associated with the advanced coal plant, including costs above a $2.4 billion price cap previously set by the commission. The 582-megawatt Kemper County plant is one of only two integrated gasification combined-cycle (IGCC) plants being built in the country. It is designed to burn lignite from a nearby mine using a technology developed by another unit of Southern Co over the past decade. The Kemper plant, which will capture a portion of its carbon dioxide emissions for use in enhanced oil and gas operations, is scheduled to begin operation in May 2014. If approved by regulators, a rate request would represent a 21 percent rate increase that could show up on customer bills as early as April, Southern Co Chief Executive Officer Art Beattie told analysts on a call Friday. Mississippi Power is the smallest unit of Atlanta-based Southern Co, with just 185,000 customers, so the rate impact of the costly Kemper facility is of concern to regulators and consumer groups in the state. Opponents argue the plant is no longer economical with natural gas prices falling. Thursday’s settlement agreement overturned the commission’s previous order to deny any rate increase related to Kemper until a legal challenge from an environmental group, the Sierra Club, was resolved. Now the commission will allow Mississippi Power to seek recovery of early Kemper financing costs with the understanding that the “construction work in progress,” or CWIP, funds will help reduce the overall interest that customers pay for the plant over time. The settlement also gives the utility a new way to recover escalating construction costs through securitization. The commission had previously “capped” the amount that Mississippi Power could recover from its customers through base rates at $2.4 billion, plus some contingency funds, for a total of $2.88 billion. Customers would also pay for the adjacent lignite mine and a CO2 pipeline, now pegged at $377 million. Cost overruns have already pushed Kemper’s price tag to the $2.8 billion level, according to PSC reports. Under the settlement, Mississippi Power is now seeking a new state law that will mandate the use of securitized bonds to cover any additional costs of the plant “not addressed in base rates,”  officials told analysts. “While there is much work to be done, this agreement defines a much-needed process for rate recovery to be considered,” said Southern Chief Executive Officer Tom Fanning. With securitization, a utility sells bonds which are repaid over a long period of time through a charge on customers’ bills. The process benefits the utility because it recovers its money quickly. Customers benefit because current interest rates are generally much lower than the interest earned by the utility. “Securitization looks like a creative way of dealing with the potential rate impact of the cost of the plant,” said Paul Patterson, an energy analyst with Glenrock Associates. Commissioner Brandon Presley, who has consistently opposed the Kemper project for its high price tag and untried technology, voted against Thursday’s settlement. “I have consistently said that I oppose the general concept of customers paying for a project before they get any benefit from it,” Presley said. “Nothing in the settlement changes that scenario.” Friday’s CWIP rate request will likely increase interest in a Mississippi Supreme Court hearing set for Monday on a constitutional challenge to the Baseload Act, a 2008 law which first allowed utilities the option to seek higher rates during power-plant construction. “With this new development, I’m optimistic that the court will render a decision that will clarify these issues within a reasonable period of time,” said Michael Adelman, an attorney representing a utility customer in the cross appeal. ",1252013,http://www.reuters.com/article/utilities-southern-kemper/southern-co-unit-requests-higher-rates-for-kemper-coal-plant-idUSL1N0AUDM820130125
